id,dataset_id,title,title_translation,location,latitude,longitude,auto_geocoded,language,glottolog_id,culture,culture_dplace_id,culture_hraf_id,genres,performers,performer_genders,instrumentation,instrument_use,percussion_use,voice_use,tonality,scale,ambitus,tempo,beat_duration,meters,metric_classification,collectors,collection_date,collection_date_earliest,collection_date_latest,publication_key,publication_type,publication_title,publication_authors,publication_date,publication_page_num,publication_song_num,tune_family_id,catalogue_num,publication_preview_url,encoders,encoding_date,contributors,copyright,license_id,file_path,file_format,version,file_checksum,file_url,file_preview_url,file_has_lyrics,file_has_music,file_has_licence,other_fields,comments,warnings,description,lyrics,lyrics_translation
natmn152,essen-china-natmin,Tao jinshang During the reward,,Neimeng,,,,,,Menggu,,,,,,,,,,,,,,,,simple duple,,,,,,,,,,,,,C0568,,Helmut Schaffrath,,,,,data/natmn152.krn,kern,1.0,fbb29a169835899afb8d4db4d78232cc,https://verovio.humdrum.org/?file=essen/asia/china/natmin/natmn152.krn,https://kern.humdrum.org/cgi-bin/ksdata?file=natmn152.krn&l=essen/asia/china/natmin&format=kern,False,True,,,"00010] TT[TB|Eigene Aufnahme|MM, S. 825|Saenger: Chao Lun Batou, der das Buch nur zum Nachschlagen|benutzte und ansonsten auswendig sang. Da er aus dem Osten der|Neimeng kommt, kennt er nicht so viele Lieder des Westens.|Alle Lieder wurden mit erkaelteter, halber Stimme in meinem|Zimmer gesungen. FOTO VORHANDEN (DIAS)  31.3.87|Variante.",,,,
natmn153,essen-china-natmin,Ershi feng luotuo Twenty camels,,Neimeng,,,,,,Menggu,,,,,,,,,,,,,,,,simple duple,,,,,,,,,,,,,C0569,,Helmut Schaffrath,,,,,data/natmn153.krn,kern,1.0,36759057e5b139032ee8f5aba69e2ced,https://verovio.humdrum.org/?file=essen/asia/china/natmin/natmn153.krn,https://kern.humdrum.org/cgi-bin/ksdata?file=natmn153.krn&l=essen/asia/china/natmin&format=kern,False,True,,,"00010] TT[TB|Eigene Aufnahme|MM, S. 836|Saenger: Chao Lun Batou, der das Buch nur zum Nachschlagen|benutzte und ansonsten auswendig sang. Da er aus dem Osten der|Neimeng kommt, kennt er nicht so viele Lieder des Westens.|Alle Lieder wurden mit erkaelteter, halber Stimme in meinem|Zimmer gesungen. FOTO VORHANDEN (DIAS)  31.3.87|Variante. 2 Strophen",,,,
natmn154,essen-china-natmin,Shan dan zi liu ma The horse of deep violet like sandalwood colour,,Neimeng,,,,,,Menggu,,,,,,,,,,,,,,,,simple duple,,,,,,,,,,,,,C0570,,Helmut Schaffrath,,,,,data/natmn154.krn,kern,1.0,e66e7cbe51b17c21ccfcf364b1e68ff2,https://verovio.humdrum.org/?file=essen/asia/china/natmin/natmn154.krn,https://kern.humdrum.org/cgi-bin/ksdata?file=natmn154.krn&l=essen/asia/china/natmin&format=kern,False,True,,,"00010] TT[TB|Eigene Aufnahme|MM, S. 842|Saenger: Chao Lun Batou, der das Buch nur zum Nachschlagen|benutzte und ansonsten auswendig sang. Da er aus dem Osten der|Neimeng kommt, kennt er nicht so viele Lieder des Westens.|Alle Lieder wurden mit erkaelteter, halber Stimme in meinem|Zimmer gesungen. FOTO VORHANDEN (DIAS)  31.3.87|Vereinzelt Verzierungen. OFFENBAR ANDERES LIED!",,,,
natmn155,essen-china-natmin,Dang de jia yu hao,,Neimeng,,,,,,Menggu,,,,,,,,,,,,,,,,simple duple,,,,,,,,,,,,,C0525,,Helmut Schaffrath,,,,,data/natmn155.krn,kern,1.0,81a3dc9dd5bee38ead93818f1f8d99fd,https://verovio.humdrum.org/?file=essen/asia/china/natmin/natmn155.krn,https://kern.humdrum.org/cgi-bin/ksdata?file=natmn155.krn&l=essen/asia/china/natmin&format=kern,False,True,,,"00009] TT[TB|Zhongguo changpian 1959; 3-6950Z (*650704)  (J 5613)|MM, Komposition vorhanden|KEIN VOLKSLIED",,,,
natmn156,essen-china-natmin,Laodong muofan Anbu qima,,Neimeng,,,,,,Menggu,,,,,,,,,,,,,,,,simple duple,,,,,,,,,,,,,C0524,,Helmut Schaffrath,,,,,data/natmn156.krn,kern,1.0,262214ab9dfdd88c74fa59ce0ea55ad9,https://verovio.humdrum.org/?file=essen/asia/china/natmin/natmn156.krn,https://kern.humdrum.org/cgi-bin/ksdata?file=natmn156.krn&l=essen/asia/china/natmin&format=kern,False,True,,,"00009] TT[TB|Zhongguo changpian 1959; 3-6950Z (*650704)  (J 5613)|MM, vorhanden|Text= Original, Mel = Bearbeitung",,,,
natmn157,essen-china-natmin,Ma yi la,,Xinjiang,,,,,,Hasake,,,,,,,,,,,,,,,,simple triple,,,,,,,,,,,,,C0966,,Helmut Schaffrath,,,,,data/natmn157.krn,kern,1.0,7eaccaba21108534c79a17d7d7e35b4c,https://verovio.humdrum.org/?file=essen/asia/china/natmin/natmn157.krn,https://kern.humdrum.org/cgi-bin/ksdata?file=natmn157.krn&l=essen/asia/china/natmin&format=kern,False,True,,,"00027] TT[TB|Eigene Aufnahme, Guangzhou, 5.5.87|MM,           (Quelle S. Bandprotokoll)|Die Saengerin Lei Huilan ist Angehoerige der Zhuang Minderheit und|studiert an der Guangzhouer Musikhochschule.|Aufgenommen am 5.5.87|Angegeben ist die 3. Strophe; die ersten beiden sind 1 Takt kuerzer|und enden infolgedessen mit 2 Takten 1__.",,,,
natmn158,essen-china-natmin,Li han hong gege er,,Neimeng,,,,,,Menggu,,,,,,,,,,,,,,,,irregular,,,,,,,,,,,,,C0527,,Helmut Schaffrath,,,,,data/natmn158.krn,kern,1.0,95794902ae19b2bd0bc23ba1ffb625f1,https://verovio.humdrum.org/?file=essen/asia/china/natmin/natmn158.krn,https://kern.humdrum.org/cgi-bin/ksdata?file=natmn158.krn&l=essen/asia/china/natmin&format=kern,False,True,,,"00009] TT[TB|Zh. Ch. 1-0641 (*54015-4) (J2170)|MM, (Variante!) vorhanden|Irregular meter.|rhythmisch frei. Foto von Label: 87 3 30|Mehrere Verzierungen. Die Gruppe 656+1 in Zeile 266 ist als Quartole|notiert.",,,,
natmn159,essen-china-natmin,Yuekan yue xihuan,,Neimeng,,,,,,Menggu,,,,,,,,,,,,,,,,simple duple,,,,,,,,,,,,,C0529,,Helmut Schaffrath,,,,,data/natmn159.krn,kern,1.0,93144d0ae6137fc67bce64d713da0aee,https://verovio.humdrum.org/?file=essen/asia/china/natmin/natmn159.krn,https://kern.humdrum.org/cgi-bin/ksdata?file=natmn159.krn&l=essen/asia/china/natmin&format=kern,False,True,,,"00009] TT[TB|Zh. Ch. 1-2210 (*580086) (J1620)   (24.6.64 angeschafft)  B|MM, (Variante!) vorhanden|rhythmisch frei. Cut 16 uebersprungen.....",,,,
natmn160,essen-china-natmin,Bao shan                       (Schatzberg),,Neimeng,,,,,,Menggu,,,,,,,,,,,,,,,,irregular,,,,,,,,,,,,,C0528,,Helmut Schaffrath,,,,,data/natmn160.krn,kern,1.0,ae89a65e24041b325c86a8430e102add,https://verovio.humdrum.org/?file=essen/asia/china/natmin/natmn160.krn,https://kern.humdrum.org/cgi-bin/ksdata?file=natmn160.krn&l=essen/asia/china/natmin&format=kern,False,True,,,"00009] TT[TB|Zh. Ch. 1-2210 (*580086) (J1620)   (24.6.64 angeschafft)|MM, (Variante!) vorhanden|Irregular meter.|rhythmisch frei. Foto von Label: 87 3 30|Einige Verzierungen.|Die 7. Note ist im Original um einen Punkt verlaengert! Hier gekuerzt.|CUT 16 FEHLT !! ++++++++++++++++++++++++",,,,
natmn161,essen-china-natmin,NN,,Neimeng,,,,,,Menggu,,,,,,,,,,,,,,,,simple duple,,,,,,,,,,,,,C1209,,Helmut Schaffrath,,,,,data/natmn161.krn,kern,1.0,012dcfedbcdf50e414c053b26a38de80,https://verovio.humdrum.org/?file=essen/asia/china/natmin/natmn161.krn,https://kern.humdrum.org/cgi-bin/ksdata?file=natmn161.krn&l=essen/asia/china/natmin&format=kern,False,True,,,"00044] TT[TB|Umschnitt einer Kassette von Li Wenzhen (TDK2)|MM, Quelle S. 6 Nr. 1",,,,
natmn162,essen-china-natmin,A xi li xi,,"Guizhou, Weining",,,,,,Yi,,,,,,,,,,,,,,,,simple duple,,,,,,,,,,,,,C0792,,Helmut Schaffrath,,,,,data/natmn162.krn,kern,1.0,890dd1cbfc249216ab8975b9fc1ba1e0,https://verovio.humdrum.org/?file=essen/asia/china/natmin/natmn162.krn,https://kern.humdrum.org/cgi-bin/ksdata?file=natmn162.krn&l=essen/asia/china/natmin&format=kern,False,True,,,"00053] TT[KA|Kassette von Frau Li Wenzhen, Peking - Zum Gesangsheft|MM,, Seite 21, 2|Die Stuecke sind meist uebersteuert, also verzerrt.",,,,
natmn163,essen-china-natmin,Yaolan qu,,"Heilongjiang, Heihe",,,,,,Elunchun,,,,,,,,,,,,,,,,irregular,,,,,,,,,,,,,C1124,,Helmut Schaffrath,,,,,data/natmn163.krn,kern,1.0,c6dbf1c9141138ea341f36580eb7b236,https://verovio.humdrum.org/?file=essen/asia/china/natmin/natmn163.krn,https://kern.humdrum.org/cgi-bin/ksdata?file=natmn163.krn&l=essen/asia/china/natmin&format=kern,False,True,,,"00053] TT[KA|Kassette von Frau Li Wenzhen, Peking - Zum Gesangsheft|MM,, Seite 22, 2|Mixed meters:  3/4; 4/4|Die Stuecke sind meist uebersteuert, also verzerrt.|Wenig Verzierungen.",,,,
natmn164,essen-china-natmin,Wu yang reqing de ge,,Heilongjiang,,,,,,Dawoer,,,,,,,,,,,,,,,,simple duple,,,,,,,,,,,,,C1131,,Helmut Schaffrath,,,,,data/natmn164.krn,kern,1.0,47e34ad9c61a4c2e1c5fb6aa5cf7a4c7,https://verovio.humdrum.org/?file=essen/asia/china/natmin/natmn164.krn,https://kern.humdrum.org/cgi-bin/ksdata?file=natmn164.krn&l=essen/asia/china/natmin&format=kern,False,True,,,"00053] TT[KA|Kassette von Frau Li Wenzhen, Peking - Zum Gesangsheft|MM,, Seite 24, 2|Die Stuecke sind meist uebersteuert, also verzerrt.|Wenig Verzierungen.",,,,
natmn165,essen-china-natmin,Chuse de geshou,,Heilongjiang,,,,,,Elunchun,,,,,,,,,,,,,,,,irregular,,,,,,,,,,,,,C1123,,Helmut Schaffrath,,,,,data/natmn165.krn,kern,1.0,5ef38dba2b393a8fcdf6e8377891bacf,https://verovio.humdrum.org/?file=essen/asia/china/natmin/natmn165.krn,https://kern.humdrum.org/cgi-bin/ksdata?file=natmn165.krn&l=essen/asia/china/natmin&format=kern,False,True,,,"00053] TT[KA|Kassette von Frau Li Wenzhen, Peking - Zum Gesangsheft|MM,, Seite 26, 1|Mixed meters:  3/4; 4/4|Die Stuecke sind meist uebersteuert, also verzerrt.|Vereinzelt Verzierungen.",,,,
natmn166,essen-china-natmin,Kong qi qu,,Dongbei,,,,,,Man,,,,,,,,,,,,,,,,irregular,,,,,,,,,,,,,C0796,,Helmut Schaffrath,,,,,data/natmn166.krn,kern,1.0,159bdd2885797c1f6bd94f63c1573e89,https://verovio.humdrum.org/?file=essen/asia/china/natmin/natmn166.krn,https://kern.humdrum.org/cgi-bin/ksdata?file=natmn166.krn&l=essen/asia/china/natmin&format=kern,False,True,,,"00053] TT[KA|Kassette von Frau Li Wenzhen, Peking - Zum Gesangsheft|MM,, Seite 26, 2|Mixed meters:  2/4; 3/4|Die Stuecke sind meist uebersteuert, also verzerrt.|Wenig Verzierungen. Schreibfehler: T.1 analog zu T.4 geaendert.",,,,
natmn167,essen-china-natmin,Shier yue jie qi,,Fujian,,,,,,She,,,,,,,,,,,,,,,,irregular,,,,,,,,,,,,,C1277,,Helmut Schaffrath,,,,,data/natmn167.krn,kern,1.0,c23cd77d72f2a6aa5a911818252e716f,https://verovio.humdrum.org/?file=essen/asia/china/natmin/natmn167.krn,https://kern.humdrum.org/cgi-bin/ksdata?file=natmn167.krn&l=essen/asia/china/natmin&format=kern,False,True,,,"00053] TT[KA|Kassette von Frau Li Wenzhen, Peking - Zum Gesangsheft|MM,, Seite 27, 2|Mixed meters:  3/4; 4/4|Die Stuecke sind meist uebersteuert, also verzerrt.|Vereinzelt Verzierungen.",,,,
natmn168,essen-china-natmin,Hao hua hong,,Guizhou,,,,,,Buyi,,,,,,,,,,,,,,,,irregular,,,,,,,,,,,,,C0793,,Helmut Schaffrath,,,,,data/natmn168.krn,kern,1.0,07b876469fa43f6a9388f08a9dc45aba,https://verovio.humdrum.org/?file=essen/asia/china/natmin/natmn168.krn,https://kern.humdrum.org/cgi-bin/ksdata?file=natmn168.krn&l=essen/asia/china/natmin&format=kern,False,True,,,"00053] TT[KA|Kassette von Frau Li Wenzhen, Peking - Zum Gesangsheft|MM,, Seite 28, 1|5/42+3 metric grouping|Mixed meters:  4/4; 3/4|Die Stuecke sind meist uebersteuert, also verzerrt.|Einige Verzierungen.",,,,
natmn169,essen-china-natmin,Ke laidao jia le,,Guizhou,,,,,,Miao,,,,,,,,,,,,,,,,irregular,,,,,,,,,,,,,C0791,,Helmut Schaffrath,,,,,data/natmn169.krn,kern,1.0,cb099d3d99fbc4548796590b7f62ca97,https://verovio.humdrum.org/?file=essen/asia/china/natmin/natmn169.krn,https://kern.humdrum.org/cgi-bin/ksdata?file=natmn169.krn&l=essen/asia/china/natmin&format=kern,False,True,,,"00053] TT[KA|Kassette von Frau Li Wenzhen, Peking - Zum Gesangsheft|MM,, Seite 29, 2|Mixed meters:  3/4; 2/4; 4/4|Die Stuecke sind meist uebersteuert, also verzerrt.|+++Die Noten sind richtig, obwohl der Gesang hier nicht|uebereinstimmt.|Mehrere Verzierungen, Glissandi. Tempowechsel ab T.15 (04=48 bzw. 90)|Phr.2, T.2.1 analog zu Phr. 1/3 geaendert.",,,,
natmn170,essen-china-natmin,Yi ma ya ji song,,"Sichuan, West(zwischen Tiebetund Sichuan",,,,,,Zang,,,,,,,,,,,,,,,,irregular,,,,,,,,,,,,,C1275,,Helmut Schaffrath,,,,,data/natmn170.krn,kern,1.0,51d5c9ecd9a27668d357814b2a08f875,https://verovio.humdrum.org/?file=essen/asia/china/natmin/natmn170.krn,https://kern.humdrum.org/cgi-bin/ksdata?file=natmn170.krn&l=essen/asia/china/natmin&format=kern,False,True,,,"00053] TT[KA|Kassette von Frau Li Wenzhen, Peking - Zum Gesangsheft|MM,, Seite 30, 3|Mixed meters:  2/4; 3/4|Die Stuecke sind meist uebersteuert, also verzerrt.|Vor- und Zwischenspiel weggelassen.",,,,
natmn171,essen-china-natmin,Nuo en ji ya,,Neimeng,,,,,,Menggu,,,,,,,,,,,,,,,,simple quadruple,,,,,,,,,,,,,C1276,,Helmut Schaffrath,,,,,data/natmn171.krn,kern,1.0,2e8b64524144986c8c8001df8232d030,https://verovio.humdrum.org/?file=essen/asia/china/natmin/natmn171.krn,https://kern.humdrum.org/cgi-bin/ksdata?file=natmn171.krn&l=essen/asia/china/natmin&format=kern,False,True,,,"00053] TT[KA|Kassette von Frau Li Wenzhen, Peking - Zum Gesangsheft|MM,, Seite 31, 2|Die Stuecke sind meist uebersteuert, also verzerrt.|Vereinzelt Verzierungen.",,,,
natmn172,essen-china-natmin,Nande jinri you xiangfeng,,"Guangxi, Nandan",,,,,,Zhuang,,,,,,,,,,,,,,,,irregular,,,,,,,,,,,,,C0787,,Helmut Schaffrath,,,,,data/natmn172.krn,kern,1.0,900b1fe8444edd233e87f8c76a375b46,https://verovio.humdrum.org/?file=essen/asia/china/natmin/natmn172.krn,https://kern.humdrum.org/cgi-bin/ksdata?file=natmn172.krn&l=essen/asia/china/natmin&format=kern,False,True,,,"00053] TT[KA|Kassette von Frau Li Wenzhen, Peking - Zum Gesangsheft|MM,, Seite 32, 3|Mixed meters:  2/4; 3/4|Die Stuecke sind meist uebersteuert, also verzerrt.|+++ Zum Analysieren nur die untere Zeile kodieren!",,,,
natmn173,essen-china-natmin,Xiao hua ma,,Neimeng (Naehe Jilin),,,,,,"Menggu,     (gesungen)",,,,,,,,,,,,,,,,irregular,,,,,,,,,,,,,C0177A,,Helmut Schaffrath,,,,,data/natmn173.krn,kern,1.0,f4d0728ca908dfb46920b76224137ad5,https://verovio.humdrum.org/?file=essen/asia/china/natmin/natmn173.krn,https://kern.humdrum.org/cgi-bin/ksdata?file=natmn173.krn&l=essen/asia/china/natmin&format=kern,False,True,,,00008] TT[TB|Eigene Aufnahme  +++ BAND 8 +++|Transkription|Irregular meter.|Der Grundton in der Transkription ist der Einfachheit halber E.|Die Aehnlichkeit zur vorgefundenen Notation kann man nur noch|ahnen. Keins der zahlreichen Tremoli wurde notiert. Die Tonlaengen|wurden hier nur ungefaehr (!) ausgezaehlt. Der Klang dieser|Transkription (Synthi etc.) kann nur enttaeuschen.,,,,
natmn174,essen-china-natmin,Sen ji de ma,,Neimeng,,,,,,"Menggu,",,,,,,,,,,,,,,,,irregular,,,,,,,,,,,,,C0187A,,Helmut Schaffrath,,,,,data/natmn174.krn,kern,1.0,1fbd9a79407e94fbcd23dab1e1a63da2,https://verovio.humdrum.org/?file=essen/asia/china/natmin/natmn174.krn,https://kern.humdrum.org/cgi-bin/ksdata?file=natmn174.krn&l=essen/asia/china/natmin&format=kern,False,True,,,00008] TT[TB|Eigene Aufnahme   +++ BAND 8 +++|Transkription|Irregular meter.,,,,
natmn175,essen-china-natmin,Cang lao de da yan,,Neimeng,,,,,,"Menggu,",,,,,,,,,,,,,,,,irregular,,,,,,,,,,,,,C0195A,,Helmut Schaffrath,,,,,data/natmn175.krn,kern,1.0,fbfc15312eb0d1e06011e50e57d8363c,https://verovio.humdrum.org/?file=essen/asia/china/natmin/natmn175.krn,https://kern.humdrum.org/cgi-bin/ksdata?file=natmn175.krn&l=essen/asia/china/natmin&format=kern,False,True,,,"00008] TT[TB|Eigene Aufnahme   +++ BAND 8 +++|Transkription|Irregular meter.|Dieser Vortrag ist zwar ""metrisch"", nicht aber vernuenftig in Takte|einteilbar. Die Pieps-Programme stoeren, wenn sie zwei Oktaven hoeher|erklingen als der Gesang. Das ""timbre"" kann natuerlich nicht imitiert|werden. Die Notenlaengen sind jedoch exakt ausgezaehlt.",,,,
natmn176,essen-china-natmin,Lu peng de yu shu,,Neimeng,,,,,,"Menggu,",,,,,,,,,,,,,,,,simple duple,,,,,,,,,,,,,C0198A,,Helmut Schaffrath,,,,,data/natmn176.krn,kern,1.0,f185c95d1c5a232b275463d5840d125f,https://verovio.humdrum.org/?file=essen/asia/china/natmin/natmn176.krn,https://kern.humdrum.org/cgi-bin/ksdata?file=natmn176.krn&l=essen/asia/china/natmin&format=kern,False,True,,,"00008] TT[TB|Eigene Aufnahme   +++ BAND 8 +++|Transkription|Der erste Kadenzton unterscheidet sich von der Notation, wenn diese|nicht fehlerhaft ist. Fraglich ist auch, ob man nicht 1=H annehmen|muesste. - Der Saenger singt die zweite Strophe etwas anders.",,,,
natmn177,essen-china-natmin,Huangjiang jao The horns of male antilope,,Neimeng,,,,,,"Menggu,",,,,,,,,,,,,,,,,irregular,,,,,,,,,,,,,C0577A,,Helmut Schaffrath,,,,,data/natmn177.krn,kern,1.0,8d74e79264e26fbed3576572d0de54e5,https://verovio.humdrum.org/?file=essen/asia/china/natmin/natmn177.krn,https://kern.humdrum.org/cgi-bin/ksdata?file=natmn177.krn&l=essen/asia/china/natmin&format=kern,False,True,,,"00010] TT[TB|Eigene Aufnahme +++ BAND 10 +++|Transkription|Irregular meter.|Nicht unmoeglich, die Transkription in einen 6/4-Takt zu zwaengen.|Hier wird die dritte Zeile der Notation nicht gesungen. Die Notation|geht von einem 5-Zeiler aus. - Korrektur nach Shen Qia (2. Zeile).",,,,
natmn178,essen-china-natmin,Unbekannt,,NN,,,,,,,,,,,,,,,,,,,,,,irregular,,,,,,,,,,,,,C0000,,Helmut Schaffrath,,,,,data/natmn178.krn,kern,1.0,68ec6393db554bd160db79a7b3e71649,https://verovio.humdrum.org/?file=essen/asia/china/natmin/natmn178.krn,https://kern.humdrum.org/cgi-bin/ksdata?file=natmn178.krn&l=essen/asia/china/natmin&format=kern,False,True,,,00049] TT[KA|NN|Ethnic Group:||Mixed meters:  2/4; 3/4,,,,
natmn179,essen-china-natmin,Zhai cai Xiaodiao,,Guizhou,,,,,,,,,,,,,,,,,,,,,,simple duple,,,,,,,,,,,,,C0000,,Helmut Schaffrath,,,,,data/natmn179.krn,kern,1.0,78ff10b5a3504a0e55f9cf1e1d1b6992,https://verovio.humdrum.org/?file=essen/asia/china/natmin/natmn179.krn,https://kern.humdrum.org/cgi-bin/ksdata?file=natmn179.krn&l=essen/asia/china/natmin&format=kern,False,True,,,"00000] TT[00|Zhongguo Minge Jing Xuan, S. 37|Zwei Sprechtakte als Pausen eingefgt.",,,,
natmn180,essen-china-natmin,He bian ge,,"Guizhou, Congjiang (Sdwesten)",,,,,,Dong,,,,,,,,,,,,,,,,irregular,,,,,,,,,,,,,C0217B,,Helmut Schaffrath,,,,,data/natmn180.krn,kern,1.0,3955833232a2d9f33fded7019115f478,https://verovio.humdrum.org/?file=essen/asia/china/natmin/natmn180.krn,https://kern.humdrum.org/cgi-bin/ksdata?file=natmn180.krn&l=essen/asia/china/natmin&format=kern,False,True,,,"00000] TT[00|NN|II, 161|Mixed meters:  2/4; 3/4|zweistimmig! Gr. u. kl. 2 gelten hier als Konsonanzen!|2 Lieder = 2 Dokumente. Die 2. Stimme ist in diesem Dokument unter|gleicher Signatur kodiert. Mehrere Verzierungen.|Phr.2, T.3 bis Phr. 5 zweistimmig: bis Phr.3 Orgelpunkt auf -6 in der|Unterstimme, ab Phr.4 Orgelpunkt in der Oberstimme.",,,,
natmn181,essen-china-natmin,Salazu renmin bashenfan,,Qinghai Xiunhua,,,,,,Sala,,,,,,,,,,,,,,,,simple duple,,,,,,,,,,,,,S4647,,Helmut Schaffrath,,,,,data/natmn181.krn,kern,1.0,16d28f2833b20bd08db95c323a09c4fb,https://verovio.humdrum.org/?file=essen/asia/china/natmin/natmn181.krn,https://kern.humdrum.org/cgi-bin/ksdata?file=natmn181.krn&l=essen/asia/china/natmin&format=kern,False,True,,,"I, 216 (2)",,,,
natmn182,essen-china-natmin,Ga laohan,,"Ningxia, Tongxin",,,,,,Hui,,,,,,,,,,,,,,,,simple duple,,,,,,,,,,,,,C0491,,Helmut Schaffrath,,,,,data/natmn182.krn,kern,1.0,c8d9b42bf8cf0f44492754cb61100884,https://verovio.humdrum.org/?file=essen/asia/china/natmin/natmn182.krn,https://kern.humdrum.org/cgi-bin/ksdata?file=natmn182.krn&l=essen/asia/china/natmin&format=kern,False,True,,,"00000] TT[00|I, 202",,,,
natmn183,essen-china-natmin,Nai niudu ge,,Gansu,,,,,,Yugu,,,,,,,,,,,,,,,,irregular,,,,,,,,,,,,,C1150,,Helmut Schaffrath,,,,,data/natmn183.krn,kern,1.0,2600a727f58977db37e865eabf9d0303,https://verovio.humdrum.org/?file=essen/asia/china/natmin/natmn183.krn,https://kern.humdrum.org/cgi-bin/ksdata?file=natmn183.krn&l=essen/asia/china/natmin&format=kern,False,True,,,"00000] TT[00|Zhongguo Minge Jing Xuan, S. 245|Mixed meters:  2/4; 3/4",,,,
natmn184,essen-china-natmin,Alamuhan,,Xinjiang,,,,,,Weiwuer,,,,,,,,,,,,,,,,simple quadruple,,,,,,,,,,,,,C1154,,Helmut Schaffrath,,,,,data/natmn184.krn,kern,1.0,d4a6415281ba0e92de1de3e4a61296ce,https://verovio.humdrum.org/?file=essen/asia/china/natmin/natmn184.krn,https://kern.humdrum.org/cgi-bin/ksdata?file=natmn184.krn&l=essen/asia/china/natmin&format=kern,False,True,,,"00000] TT[00|Zhungguo Mingge Xuan, S. 270",,,,
natmn185,essen-china-natmin,Ni song wo yizhi meigui hua,,Xinjiang,,,,,,Weiwuer,,,,,,,,,,,,,,,,simple duple,,,,,,,,,,,,,C1155,,Helmut Schaffrath,,,,,data/natmn185.krn,kern,1.0,c2f587537de96fbcb30d8baf086190f0,https://verovio.humdrum.org/?file=essen/asia/china/natmin/natmn185.krn,https://kern.humdrum.org/cgi-bin/ksdata?file=natmn185.krn&l=essen/asia/china/natmin&format=kern,False,True,,,00000] TT[00|Zhongguo Minge Xuan S.260|+++ Grundton muá C sein! +++,,,,
natmn186,essen-china-natmin,Wo de hua er,,"Xinjiang, Yili(Nordwesten)",,,,,,Hasake,,,,,,,,,,,,,,,,irregular,,,,,,,,,,,,,C0433,,Helmut Schaffrath,,,,,data/natmn186.krn,kern,1.0,65574f6181b5cc8f48ac5c729ff42ae3,https://verovio.humdrum.org/?file=essen/asia/china/natmin/natmn186.krn,https://kern.humdrum.org/cgi-bin/ksdata?file=natmn186.krn&l=essen/asia/china/natmin&format=kern,False,True,,,"00026] TT[TB|Eigene Aufnahme|IV, 506|Mixed meters:  2/4; 3/4|Vorspiel|Sehr bekannt|Die Saengerin Lei Huilan ist Angehoerige der Zhuang Minderheit und|studiert an der Guangzhouer Musikhochschule.|aufgenommen am 5.5.87|+++AUCH AUF KASSETTE 1 = 46, CUT 7 (B-Seite)|Vereinzelt Verzierungen. Vorspiel weggelassen.|Pinyin-Text der ersten Strophe vorhanden!",,,,
natmn187,essen-china-natmin,Meilide gu niang ,,"Xinjiang, Yili",,,,,,Hasake,,,,,,,,,,,,,,,,irregular,,,,,,,,,,,,,C0432,,Helmut Schaffrath,,,,,data/natmn187.krn,kern,1.0,2959693e6d8aa2b939fc8f93bce02ae6,https://verovio.humdrum.org/?file=essen/asia/china/natmin/natmn187.krn,https://kern.humdrum.org/cgi-bin/ksdata?file=natmn187.krn&l=essen/asia/china/natmin&format=kern,False,True,,,"00026] TT[TB|Eigene Aufnahme|IV, 501|Mixed meters:  2/4; 3/4|Wird oft vorgespielt.|Die Saengerin Lei Huilan ist Angehoerige der Zhuang Minderheit und|studiert an der Guangzhouer Musikhochschule.|Aufgenommen am 5.5.87|Vorspiel weggelassen.",,,,
natmn188,essen-china-natmin,Gadameiling,,"Mongulei, Zelimumeng",,,,,,Menggu,,,,,,,,,,,,,,,,simple quadruple,,,,,,,,,,,,,C0184,,Helmut Schaffrath,,,,,data/natmn188.krn,kern,1.0,cb0212ca2d0058fe122c980c7f460124,https://verovio.humdrum.org/?file=essen/asia/china/natmin/natmn188.krn,https://kern.humdrum.org/cgi-bin/ksdata?file=natmn188.krn&l=essen/asia/china/natmin&format=kern,False,True,,,"00008] TT[TB|Eigene Aufnahme|IV, 290|ethnisch - nationale Geschichte betreffend|Sehr bekannt. Viele haben zu dieser Melodie neue Texte|geschrieben. Diese Melodie erscheint auch in sinfonischen|Dichtungen und einem Violinkonzert (z.B. San Tong).|Erzaehlt wird die Geschichte eines Bauernaufstandes gegen die|Qin-Dynastie. Gadameiling ist der Anfuehrer. Zwischen den Strophen|koennen Geschichten erzaehlt werden; alles kann dann eine|Ewigkeit dauern. In dem Falle mit Sihu begleitet.|STARKES NETZBRUNMMEN. DAHER NEU AUFGENOMMEN.|Saenger: Chao Lun Batou, 2 Strophen.|Pinyin-Text der ersten Strophe vorhanden!",,,,
natmn189,essen-china-natmin,Mu ge,,"Mongolei, Chaowudameng",,,,,,Menggu,,,,,,,,,,,,,,,,simple duple,,,,,,,,,,,,,C0194,,Helmut Schaffrath,,,,,data/natmn189.krn,kern,1.0,b02d5b511c85c296af16fb158b068e99,https://verovio.humdrum.org/?file=essen/asia/china/natmin/natmn189.krn,https://kern.humdrum.org/cgi-bin/ksdata?file=natmn189.krn&l=essen/asia/china/natmin&format=kern,False,True,,,"00008] TT[TB|Eigene Aufnahme|IV, 301|starke VARIANTE; Saenger: Chao Lun Batou",,,,
natmn190,essen-china-natmin,Senjidema,,"Mongolei, Erduos",,,,,,Menggu,,,,,,,,,,,,,,,,simple quadruple,,,,,,,,,,,,,C0187,,Helmut Schaffrath,,,,,data/natmn190.krn,kern,1.0,cb581b19f56df5efa5c043e7966d16f7,https://verovio.humdrum.org/?file=essen/asia/china/natmin/natmn190.krn,https://kern.humdrum.org/cgi-bin/ksdata?file=natmn190.krn&l=essen/asia/china/natmin&format=kern,False,True,,,"00008] TT[TB|Eigene Aufnahme|IV, 345 (2)|He Luding hat nach dieser Melodie ein kurzes Orchesterwerk|geschrieben. - Es geht um ein sehr huebsches Maedchen, das von|seinem Geliebten lange vergebens gesucht wird. Da er sie nicht|finden kann, stuerzt er sich von einem hohen Berg in den Tod.|Saenger: Chao Lun Batou; Variante, v.a. rhythmisch; Notation|trotzdem brauchbar. +++ Zwei Notationsfehler (Phrase 3,9) nach|Transkription korrigiert. Ebenso Takteinteilung in letzter Phrase. ++",,,,
natmn191,essen-china-natmin,Daolaji,,"Jilin, Yangbian",,,,,,Chaoxian,,,,,,,,,,,,,,,,simple triple,,,,,,,,,,,,,C0283,,Helmut Schaffrath,,,,,data/natmn191.krn,kern,1.0,bfda2fb79bfa7eb4413ab9c4f521c687,https://verovio.humdrum.org/?file=essen/asia/china/natmin/natmn191.krn,https://kern.humdrum.org/cgi-bin/ksdata?file=natmn191.krn&l=essen/asia/china/natmin&format=kern,False,True,,,"00000] TT[00|NN|III, 114|Koreanische Minderheit, die hier seit der Qin-Dynastie lebt-.|Ist auch in Korea sehr bekannt.|Pinyin-Text der ersten Strophe vorhanden!",,,,
natmn192,essen-china-natmin,Nongfu da tu,,Heilongjiang,,,,,,Dawo'er,,,,,,,,,,,,,,,,simple duple,,,,,,,,,,,,,C1167,,Helmut Schaffrath,,,,,data/natmn192.krn,kern,1.0,6c204615c7f101594e9d49eced28df2a,https://verovio.humdrum.org/?file=essen/asia/china/natmin/natmn192.krn,https://kern.humdrum.org/cgi-bin/ksdata?file=natmn192.krn&l=essen/asia/china/natmin&format=kern,False,True,,,"00000] TT[00|Zhongguo Minge Jing Xuan, 271",,,,
natmn193,essen-china-natmin,Shouliede gege huilai,,Heilongjiang,,,,,,Hezhe,,,,,,,,,,,,,,,,simple quadruple,,,,,,,,,,,,,C1168,,Helmut Schaffrath,,,,,data/natmn193.krn,kern,1.0,05b78f8d9ce474fa0a6381e3846744ca,https://verovio.humdrum.org/?file=essen/asia/china/natmin/natmn193.krn,https://kern.humdrum.org/cgi-bin/ksdata?file=natmn193.krn&l=essen/asia/china/natmin&format=kern,False,True,,,"00000] TT[00|Zhongguo Minge Jing Xuan, 275|Taktsummen korrigiert. Im Original falsch!",,,,
