id,dataset_id,corpus_version,title,title_translation,location,latitude,longitude,auto_geocoded,language,glottolog_id,culture,culture_dplace_id,culture_hraf_id,genres,performers,performer_genders,instrumentation,instrument_use,percussion_use,voice_use,tonality,scale,ambitus,tempo,beat_duration,meters,metric_classification,collectors,collection_date,collection_date_earliest,collection_date_latest,publication_key,publication_type,publication_title,publication_authors,publication_date,publication_page_num,publication_song_num,tune_family_id,catalogue_num,publication_preview_url,encoders,encoding_date,contributors,copyright,license_id,file_path,file_format,version,file_checksum,file_url,file_preview_url,file_has_lyrics,file_has_music,file_has_licence,other_fields,comments,warnings,description,lyrics,lyrics_translation
ute080,densmore-northern-ute,0.0.1,Scalp Dance Song (c),,"Whiterocks, Utah",40.4675,-109.929722,False,Ute,utee1244,Ute,Nd58,NT19,war,John Star (Sa'vawitopatš),male,voice,,,True,E flat major,,,169,0.5,4/8|3/8|5/8|2/8,,Frances Densmore,,1914,1916,densmore1922ute,book,Northern Ute Music,Frances Densmore,1922,158.0,80.0,,751,https://books.google.nl/books?id=fEhAAAAAYAAJ&hl=nl&pg=PA158.0,Daniel Shanahan|Eva Shanahan,2014,,Copyright 2014 Daniel and Eva Shanahan,,data/No_80_Scalp_Dance_Song_(c).krn,kern,,d48dfb5d8c6bb29ae2049ccc95500bbf,https://github.com/shanahdt/densmore/blob/master/Densmore/northern_ute/None.krn,,True,True,,"{""meta.singer_num"": 18.0, ""meta.performer_band"": ""White River and Uinta"", ""meta.performer_age_group"": ""old"", ""meta.genre"": ""war song"", ""meta.bpm_voice"": ""169"", ""meta.bpm_drum"": NaN, ""file.SOCIAL_FUNCTION"": ""war songs"", ""file.REG"": ""Southwest"", ""file.LANG"": ""Non-Tone"", ""file.LING_GROUP"": ""Uto-Aztecan""}","""Drum not recorded""",,"The measure-divisions in this song were clearly given in all the renditions, and as the tempo is so rapid it is considered advisable that the time unit be indicated as an eighth note. The rhythmic unit occurs twice and is peculiar in character. The fourth is a prominent interval, comprising more than one-fourth of the pro gressions. The minor third appears with about the same frequency. In structure the song is melodic with harmonic framework, and the melody tones are those of the major triad and sixth.",,
ute081,densmore-northern-ute,0.0.1,War Song (h),,"Whiterocks, Utah",40.4675,-109.929722,False,Ute,utee1244,Ute,,NT19,war,Charles Mack,male,voice|drum,True,True,True,B flat minor,,,60,1.0,3/4|2/4,,Frances Densmore,,1914,1916,densmore1922ute,book,Northern Ute Music,Frances Densmore,1922,159.0,81.0,,794,https://books.google.nl/books?id=fEhAAAAAYAAJ&hl=nl&pg=PA159.0,Daniel Shanahan|Eva Shanahan,2014,,Copyright 2014 Daniel and Eva Shanahan,,data/No_81_War_Song_(h).krn,kern,,8809b4fe557310c9bb33ffe9f8ba2edd,https://github.com/shanahdt/densmore/blob/master/Densmore/northern_ute/None.krn,,True,True,,"{""meta.singer_num"": 20.0, ""meta.performer_band"": NaN, ""meta.performer_age_group"": NaN, ""meta.genre"": ""war song"", ""meta.bpm_voice"": ""60"", ""meta.bpm_drum"": 60.0, ""file.SOCIAL_FUNCTION"": ""war songs"", ""file.REG"": ""Southwest"", ""file.LANG"": ""Non-Tone"", ""file.LING_GROUP"": ""Uto-Aztecan""}",,,This song has a compass of 11 tones and is on the sec ond five-toned scale. One rhythmic unit occurs which is long and varied in count-divisions. The several renditions of the song show no material variation. In structure the song is melodic. Twenty- five of the 33 progressions are minor thirds and major seconds. Of the remainder all but one are fourths.,,
ute082,densmore-northern-ute,0.0.1,War Song (i),,"Whiterocks, Utah",40.4675,-109.929722,False,Ute,utee1244,Ute,,NT19,war,Charles Mack,male,voice|drum,True,True,True,G flat major,,,92|108,1.0,3/4|2/4,,Frances Densmore,,1914,1916,densmore1922ute,book,Northern Ute Music,Frances Densmore,1922,159.0,82.0,,795,https://books.google.nl/books?id=fEhAAAAAYAAJ&hl=nl&pg=PA159.0,Daniel Shanahan|Eva Shanahan,2014,,Copyright 2014 Daniel and Eva Shanahan,,data/No_82_War_Song_(i).krn,kern,,c19bc447c9a499f109a6a7cfde72fe32,https://github.com/shanahdt/densmore/blob/master/Densmore/northern_ute/None.krn,,True,True,,"{""meta.singer_num"": 20.0, ""meta.performer_band"": NaN, ""meta.performer_age_group"": NaN, ""meta.genre"": ""war song"", ""meta.bpm_voice"": ""92"", ""meta.bpm_drum"": 108.0, ""file.SOCIAL_FUNCTION"": ""war songs"", ""file.REG"": ""Southwest"", ""file.LANG"": ""Non-Tone"", ""file.LING_GROUP"": ""Uto-Aztecan""}",,,"This song, like many others of the present series, pro gresses chiefly by whole tones (see No. 28), yet it is a melody with abundant variety and interest. In structure it is melodic and con tains the tones of the major triad and second. The drum is slightly faster than the voice and its tempo was steadily maintained. A rhythmic unit occurs six times in the song.",,
ute083,densmore-northern-ute,0.0.1,Parade Song (a),,"Whiterocks, Utah",40.4675,-109.929722,False,Ute,utee1244,Ute,Nd58,NT19,ceremonial,Isaacs (Magwitšint),,voice,,,True,E major,,,63,1.0,2/4|3/4,,Frances Densmore,,1914,1916,densmore1922ute,book,Northern Ute Music,Frances Densmore,1922,167.0,83.0,,696,https://books.google.nl/books?id=fEhAAAAAYAAJ&hl=nl&pg=PA167.0,Daniel Shanahan|Eva Shanahan,2014,,Copyright 2014 Daniel and Eva Shanahan,,data/No_83_Parade_Song_(a).krn,kern,,a94ed666570bffc7c7379440ccaecd91,https://github.com/shanahdt/densmore/blob/master/Densmore/northern_ute/None.krn,,True,True,,"{""meta.singer_num"": 4.0, ""meta.performer_band"": ""White River and Uinta"", ""meta.performer_age_group"": ""middle"", ""meta.genre"": ""parade song"", ""meta.bpm_voice"": ""63"", ""meta.bpm_drum"": NaN, ""file.SOCIAL_FUNCTION"": ""parade songs"", ""file.REG"": ""Southwest"", ""file.LANG"": ""Non-Tone"", ""file.LING_GROUP"": ""Uto-Aztecan""}","""Drum not recorded""",,"The slow tempo of this song was steadily maintained throughout three renditions, which were sung without a break in the time. The melody progresses chiefly by whole tones, which con stitute two-thirds of the intervals. The song is melodic in structure and contains all the tones of the octave except the seventh.",,
ute084,densmore-northern-ute,0.0.1,Parade Song (b),,"Whiterocks, Utah",40.4675,-109.929722,False,Ute,utee1244,Ute,Nd58,NT19,ceremonial,Charlie Saritch (Sa'ritš),male,voice,,,True,A flat major,,,66,1.0,3/4|2/4,,Frances Densmore,,1914,1916,densmore1922ute,book,Northern Ute Music,Frances Densmore,1922,167.0,84.0,,707,https://books.google.nl/books?id=fEhAAAAAYAAJ&hl=nl&pg=PA167.0,Daniel Shanahan|Eva Shanahan,2014,,Copyright 2014 Daniel and Eva Shanahan,,data/No_84_Parade_Song_(b).krn,kern,,9db994b260b943b4270949ff8be26125,https://github.com/shanahdt/densmore/blob/master/Densmore/northern_ute/None.krn,,True,True,,"{""meta.singer_num"": 9.0, ""meta.performer_band"": ""White River and Uinta"", ""meta.performer_age_group"": ""middle"", ""meta.genre"": ""parade song"", ""meta.bpm_voice"": ""66"", ""meta.bpm_drum"": NaN, ""file.SOCIAL_FUNCTION"": ""parade songs"", ""file.REG"": ""Southwest"", ""file.LANG"": ""Non-Tone"", ""file.LING_GROUP"": ""Uto-Aztecan""}","""Drum not recorded""",,"The rendering of this song was particularly clear in intonation and count divisions, not varying in the repetitions. Drum and voice have the same time unit and are synchronous. The song is peculiar in that the only progressions are fifths, fourths, and semi tones, and also in that the ascending and descending progressions are almost equal in number. The melody tones are those of the major triad and second, and the structure of the song is melodic with harmonic framework. (Concerning the connective phrase see No. 7.)",,
ute085,densmore-northern-ute,0.0.1,Parade Song (c),,"Whiterocks, Utah",40.4675,-109.929722,False,Ute,utee1244,Ute,Nd58,NT19,ceremonial,Charlie Saritch (Sa'ritš),male,voice,,,True,C major,,,92,1.0,2/4|3/4,,Frances Densmore,,1914,1916,densmore1922ute,book,Northern Ute Music,Frances Densmore,1922,168.0,85.0,,708,https://books.google.nl/books?id=fEhAAAAAYAAJ&hl=nl&pg=PA168.0,Daniel Shanahan|Eva Shanahan,2014,,Copyright 2014 Daniel and Eva Shanahan,,data/No_85_Parade_Song_(c).krn,kern,,3335e714f3c0be57cf764454b31e0fba,https://github.com/shanahdt/densmore/blob/master/Densmore/northern_ute/None.krn,,True,True,,"{""meta.singer_num"": 9.0, ""meta.performer_band"": ""White River and Uinta"", ""meta.performer_age_group"": ""middle"", ""meta.genre"": ""parade song"", ""meta.bpm_voice"": ""92"", ""meta.bpm_drum"": NaN, ""file.SOCIAL_FUNCTION"": ""parade songs"", ""file.REG"": ""Southwest"", ""file.LANG"": ""Non-Tone"", ""file.LING_GROUP"": ""Uto-Aztecan""}","""Drum not recorded""",,"Five renditions of this song were recorded, two being separated by shrill cries and the others connected by a short phrase. (See No. 7.) In every rendition the accent is changed in the last occurrence of the rhythmic unit. Minor thirds and major seconds are the principal intervals of progression, though the variety of intervals is greater than in a majority of the Ute songs under analysis.",,
ute086,densmore-northern-ute,0.0.1,Parade Song (d),,"Whiterocks, Utah",40.4675,-109.929722,False,Ute,utee1244,Ute,Nd58,NT19,ceremonial,Charlie Saritch (Sa'ritš),male,voice|drum,True,True,True,G major,,,66,1.0,3/4|2/4,,Frances Densmore,,1914,1916,densmore1922ute,book,Northern Ute Music,Frances Densmore,1922,168.0,86.0,,709,https://books.google.nl/books?id=fEhAAAAAYAAJ&hl=nl&pg=PA168.0,Daniel Shanahan|Eva Shanahan,2014,,Copyright 2014 Daniel and Eva Shanahan,,data/No_86_Parade_Song_(d).krn,kern,,99577d16c06e2b95a628a6f5f67df954,https://github.com/shanahdt/densmore/blob/master/Densmore/northern_ute/None.krn,,True,True,,"{""meta.singer_num"": 9.0, ""meta.performer_band"": ""White River and Uinta"", ""meta.performer_age_group"": ""middle"", ""meta.genre"": ""parade song"", ""meta.bpm_voice"": ""66"", ""meta.bpm_drum"": 66.0, ""file.SOCIAL_FUNCTION"": ""parade songs"", ""file.REG"": ""Southwest"", ""file.LANG"": ""Non-Tone"", ""file.LING_GROUP"": ""Uto-Aztecan""}",,,"This melody contains six kinds of intervals in ascending progression, which is an unusual number. The drumbeat in the first four measures of the first rendition was tremolo, after which the quarter-note beat was continuous. (See No. 72.) Drum and voice have the same time unit, determined by the majority of the meas ures, but the drum is steadily maintained, while the voice tempo varies slightly. The time of the transcription should be understood as indicating the accents and the approximate note values rather than actual durations, of time, resembling some of the songs in which the pitch indicated by -the notation is only approximate. These variabilities are too slight to be shown in any except an exceedingly detailed graphic form, the transcription showing, however, the trend of the melody with sufficient exactness for our present purpose. Four renditions were recorded and contain no important differences. The connective phrase in this song is unusually long. Another song using a similar phrase between renditions is No. 7.",,
ute087,densmore-northern-ute,0.0.1,Parade Song (e),,"Whiterocks, Utah",40.4675,-109.929722,False,Ute,utee1244,Ute,Nd62,NT19,ceremonial,Paul Pegaroos,male,voice|drum,True,True,True,C major,,,63,1.0,3/4|2/4,,Frances Densmore,,1914,1916,densmore1922ute,book,Northern Ute Music,Frances Densmore,1922,169.0,87.0,,771,https://books.google.nl/books?id=fEhAAAAAYAAJ&hl=nl&pg=PA169.0,Daniel Shanahan|Eva Shanahan,2014,,Copyright 2014 Daniel and Eva Shanahan,,data/No_87_Parade_Song_(e).krn,kern,,10378e0e7c67b367267ecff223ff95be,https://github.com/shanahdt/densmore/blob/master/Densmore/northern_ute/None.krn,,True,True,,"{""meta.singer_num"": 17.0, ""meta.performer_band"": ""Uncompahgre"", ""meta.performer_age_group"": ""old"", ""meta.genre"": ""parade song"", ""meta.bpm_voice"": ""63"", ""meta.bpm_drum"": 63.0, ""file.SOCIAL_FUNCTION"": ""parade songs"", ""file.REG"": ""Southwest"", ""file.LANG"": ""Non-Tone"", ""file.LING_GROUP"": ""Uto-Aztecan""}",,,"Drum and voice have the same time unit in this song, but because of slight variations in tempo they never exactly coincide. In each rendition the drumbeat was tremolo to the point marked X, after which it was in quarter notes. (See No. 72.) Three rhythmic units occur, the first being emphatic in character and appearing always on the same tones, which is unusual. The third unit differs from the second only in the division of the last count, but this dif ference was steadily maintained. The tone material is that of the fourth five-toned scale and the song has a compass of 1 2 tones. The average interval in this song comprises four semitones. Reference to the tables of analysis on page 42 will show this to be an unusually large interval.",,
ute088,densmore-northern-ute,0.0.1,Parade Song (f),,"Whiterocks, Utah",40.4675,-109.929722,False,Ute,utee1244,Ute,Nd58,NT19,ceremonial,Tim Johnson,male,voice|drum,True,True,True,D major,,,66,1.0,2/4|3/4,,Frances Densmore,,1914,1916,densmore1922ute,book,Northern Ute Music,Frances Densmore,1922,170.0,88.0,,726,https://books.google.nl/books?id=fEhAAAAAYAAJ&hl=nl&pg=PA170.0,Daniel Shanahan|Eva Shanahan,2014,,Copyright 2014 Daniel and Eva Shanahan,,data/No_88_Parade_Song_(f).krn,kern,,86f199013dbfa4c037906aaadce82d48,https://github.com/shanahdt/densmore/blob/master/Densmore/northern_ute/None.krn,,True,True,,"{""meta.singer_num"": 16.0, ""meta.performer_band"": ""White River and Uinta"", ""meta.performer_age_group"": ""old"", ""meta.genre"": ""parade song"", ""meta.bpm_voice"": ""66"", ""meta.bpm_drum"": 66.0, ""file.SOCIAL_FUNCTION"": ""parade songs"", ""file.REG"": ""Southwest"", ""file.LANG"": ""Non-Tone"", ""file.LING_GROUP"": ""Uto-Aztecan""}",,,"This song has a compass of 12 tones and contains the major triad and second. In structure it is melodic with harmonic framework. The drumbeat was tremolo to the point marked X, after which in four renditions it was in quarter-note values. (See No. 72.) The repetitions of the song necessitate an ascending interval of a twelfth, which was sung with good intonation. The fourth is the interval of most frequent occurrence, constituting 54 per cent of the entire number of intervals. (See No. 3.) This interval has frequently been noted as associated with the idea of motion.",,
ute089,densmore-northern-ute,0.0.1,Parade Song (g),,"Whiterocks, Utah",40.4675,-109.929722,False,Ute,utee1244,Ute,Nd62,NT19,ceremonial,Jim Kolorow (Tšo'kwata'piyitš),male,voice|drum,True,True,True,C major,,,60,1.0,2/4|3/4,,Frances Densmore,,1914,1916,densmore1922ute,book,Northern Ute Music,Frances Densmore,1922,170.0,89.0,,780,https://books.google.nl/books?id=fEhAAAAAYAAJ&hl=nl&pg=PA170.0,Daniel Shanahan|Eva Shanahan,2014,,Copyright 2014 Daniel and Eva Shanahan,,data/No_89_Parade_Song_(g).krn,kern,,b629b821fdc9d82bf48feee18f042749,https://github.com/shanahdt/densmore/blob/master/Densmore/northern_ute/None.krn,,True,True,,"{""meta.singer_num"": 21.0, ""meta.performer_band"": ""Uncompahgre"", ""meta.performer_age_group"": ""old"", ""meta.genre"": ""parade song"", ""meta.bpm_voice"": ""60"", ""meta.bpm_drum"": 60.0, ""file.SOCIAL_FUNCTION"": ""parade songs"", ""file.REG"": ""Southwest"", ""file.LANG"": ""Non-Tone"", ""file.LING_GROUP"": ""Uto-Aztecan""}",,,"This song has a compass of 10 tones and contains all the tones of the octave. More than half the progressions are whole tones. (See No. 28.) The lowest tone in the third measure was not always sung clearly, the descent to this tone being glissando. The time was steadily maintained throughout all the renditions, which were uniform in every respect. Other songs using a connective phrase are noted in the analysis of No. 7.",,
ute090,densmore-northern-ute,0.0.1,Parade Song (h),,"Whiterocks, Utah",40.4675,-109.929722,False,Ute,utee1244,Ute,Nd58,NT19,ceremonial,Dave Weetch (Witš),,voice|drum,True,True,True,D major,,,80,1.0,2/4|3/4,,Frances Densmore,,1914,1916,densmore1922ute,book,Northern Ute Music,Frances Densmore,1922,171.0,90.0,,793,https://books.google.nl/books?id=fEhAAAAAYAAJ&hl=nl&pg=PA171.0,Daniel Shanahan|Eva Shanahan,2014,,Copyright 2014 Daniel and Eva Shanahan,,data/No_90_Parade_Song_(h).krn,kern,,3e4b746a5da772c96c4f8b7c71613f7f,https://github.com/shanahdt/densmore/blob/master/Densmore/northern_ute/None.krn,,True,True,,"{""meta.singer_num"": 19.0, ""meta.performer_band"": ""White River and Uinta"", ""meta.performer_age_group"": ""middle"", ""meta.genre"": ""parade song"", ""meta.bpm_voice"": ""80"", ""meta.bpm_drum"": 80.0, ""file.SOCIAL_FUNCTION"": ""parade songs"", ""file.REG"": ""Southwest"", ""file.LANG"": ""Non-Tone"", ""file.LING_GROUP"": ""Uto-Aztecan""}",,,"The interval of a fourth comprises 52 per cent of the progressions in this song. (See No. 3.) No rhythmic unit occurs, and the song is not particularly rhythmic in structure. The song is major in tonality, melodic in structure, and contains all the tones of the octave except the seventh.",,
ute091,densmore-northern-ute,0.0.1,Parade Song (i),,"Whiterocks, Utah",40.4675,-109.929722,False,Ute,utee1244,Ute,Nd58,NT19,ceremonial,Quinance (Kwa'nantš),,voice|drum,True,True,True,F sharp minor,,,132,1.0,2/4|3/4,,Frances Densmore,,1914,1916,densmore1922ute,book,Northern Ute Music,Frances Densmore,1922,171.0,91.0,,735,https://books.google.nl/books?id=fEhAAAAAYAAJ&hl=nl&pg=PA171.0,Daniel Shanahan|Eva Shanahan,2014,,Copyright 2014 Daniel and Eva Shanahan,,data/No_91_Parade_Song_(i).krn,kern,,554bbd7347874244041b7a3848667d21,https://github.com/shanahdt/densmore/blob/master/Densmore/northern_ute/None.krn,,True,True,,"{""meta.singer_num"": 7.0, ""meta.performer_band"": ""White River and Uinta"", ""meta.performer_age_group"": ""middle"", ""meta.genre"": ""parade song"", ""meta.bpm_voice"": ""132"", ""meta.bpm_drum"": 132.0, ""file.SOCIAL_FUNCTION"": ""parade songs"", ""file.REG"": ""Southwest"", ""file.LANG"": ""Non-Tone"", ""file.LING_GROUP"": ""Uto-Aztecan""}",,,"Few songs of the present series are so typical as this, yet the quality which makes it typical is hard to define. Two-thirds of the intervals are minor thirds and major seconds, but in this it resembles many other songs. Neither is the proportion of ascending and descending intervals unusual, there being 40 per cent of ascending and 60 per cent of descending progressions. But the song is minor in tonality with a special prominence of the subdominant. This is quite unusual and worthy of consideration by students. The melody tones are those of the second five-toned scale with the seventh sharped. The tonic chord appears as the framework of the melody. The ascent of an octave in the first measure and the beginning and ending on the same tone are noted in the analysis of No. 37. A short con nective phrase was sung between the renditions. (See No. 7.)",,
ute092,densmore-northern-ute,0.0.1,Parade Song (j),,"Whiterocks, Utah",40.4675,-109.929722,False,Ute,utee1244,Ute,Nd58,NT19,ceremonial,Little Jim (To'pātšuk),male,voice,,,True,F major,,,132,1.0,3/4|2/4,,Frances Densmore,,1914,1916,densmore1922ute,book,Northern Ute Music,Frances Densmore,1922,172.0,92.0,,761,https://books.google.nl/books?id=fEhAAAAAYAAJ&hl=nl&pg=PA172.0,Daniel Shanahan|Eva Shanahan,2014,,Copyright 2014 Daniel and Eva Shanahan,,data/No_92_Parade_Song_(j).krn,kern,,36948c3d6e7c864c91aa5524f31113ed,https://github.com/shanahdt/densmore/blob/master/Densmore/northern_ute/None.krn,,True,True,,"{""meta.singer_num"": 1.0, ""meta.performer_band"": ""White River and Uinta"", ""meta.performer_age_group"": ""old"", ""meta.genre"": ""parade song"", ""meta.bpm_voice"": ""132"", ""meta.bpm_drum"": NaN, ""file.SOCIAL_FUNCTION"": ""parade songs"", ""file.REG"": ""Southwest"", ""file.LANG"": ""Non-Tone"", ""file.LING_GROUP"": ""Uto-Aztecan""}","""Drum not recorded""",,"Throughout the renditions of this song the intonation on the descending minor third was faulty, yet the fourth and octave were sung with good intonation. The fourth constitutes about one- third of the progressions. The song is harmonic in structure and contains the tones of the major triad and fourth. (Concerning the use of a connective phrase see No. 7.)",,
ute093,densmore-northern-ute,0.0.1,Parade Song (k),,"Whiterocks, Utah",40.4675,-109.929722,False,Ute,utee1244,Ute,Nd58,NT19,ceremonial,Little Jim (To'pātšuk),male,voice,,,True,E flat major,,,66,1.0,2/4|3/4,,Frances Densmore,,1914,1916,densmore1922ute,book,Northern Ute Music,Frances Densmore,1922,173.0,93.0,,762,https://books.google.nl/books?id=fEhAAAAAYAAJ&hl=nl&pg=PA173.0,Daniel Shanahan|Eva Shanahan,2014,,Copyright 2014 Daniel and Eva Shanahan,,data/No_93_Parade_Song_(k).krn,kern,,2e76db3917bfe0c83319cf479ba51a06,https://github.com/shanahdt/densmore/blob/master/Densmore/northern_ute/None.krn,,True,True,,"{""meta.singer_num"": 1.0, ""meta.performer_band"": ""White River and Uinta"", ""meta.performer_age_group"": ""old"", ""meta.genre"": ""parade song"", ""meta.bpm_voice"": ""66"", ""meta.bpm_drum"": NaN, ""file.SOCIAL_FUNCTION"": ""parade songs"", ""file.REG"": ""Southwest"", ""file.LANG"": ""Non-Tone"", ""file.LING_GROUP"": ""Uto-Aztecan""}","""Drum not recorded""",,"The rhythmic structure of this song is worthy of special attention. The first two measures were sung only once, after which the remainder of the song as transcribed was sung four times, the last rendition ending at the double bar. An introductory phrase is rarely used in Ute songs, though appearing frequently in the songs of the Chippewa. Other songs of this series containing a connective phrase are noted in the analysis of No. 7. In all the renditions of this song the count divisions were as indicated. The song comprises two rhythmic periods which resemble each other yet show enough difference to give variety and character to the song as a whole. The first period comprises the third, fourth, and fifth measures, and the second comprises the three following measures. A comparison of these will show the variations. The song has a compass of 1 1 tones and contains the major triad and second. The whole tone is the chief interval of progression (see No! 24). Although the song is major in tonality, the major third does not appear as a progression.",,
ute094,densmore-northern-ute,0.0.1,Hand Game Song (a),,"Whiterocks, Utah",40.4675,-109.929722,False,Ute,utee1244,Ute,Nd58,NT19,game,Isaacs (Magwitšint),,voice,,,True,D major,,,96,1.0,2/4|3/4,,Frances Densmore,,1914,1916,densmore1922ute,book,Northern Ute Music,Frances Densmore,1922,176.0,94.0,,697,https://books.google.nl/books?id=fEhAAAAAYAAJ&hl=nl&pg=PA176.0,Daniel Shanahan|Eva Shanahan,2014,,Copyright 2014 Daniel and Eva Shanahan,,data/No_94_Hand_Game_Song_(a).krn,kern,,ffc313b9835f57abe51b31dbbce970c8,https://github.com/shanahdt/densmore/blob/master/Densmore/northern_ute/None.krn,,True,True,,"{""meta.singer_num"": 4.0, ""meta.performer_band"": ""White River and Uinta"", ""meta.performer_age_group"": ""middle"", ""meta.genre"": ""hand game song"", ""meta.bpm_voice"": ""96"", ""meta.bpm_drum"": NaN, ""file.SOCIAL_FUNCTION"": ""hand game songs"", ""file.REG"": ""Southwest"", ""file.LANG"": ""Non-Tone"", ""file.LING_GROUP"": ""Uto-Aztecan""}","""Drum not recorded""",,"This song characterized by sliding upward of tone and by short rests. (See No. 8.) The rhythmic unit interesting and occurs twice. Five renditions were given with no break in the time, the final measure always containing three counts, as transcribed. The song harmonic in structure and the intervals are more varied than in majority of these songs. The melody tones are those of the major triad and second.",,
ute095,densmore-northern-ute,0.0.1,Hand Game Song (b),,"Whiterocks, Utah",40.4675,-109.929722,False,Ute,utee1244,Ute,Nd58,NT19,game,Quinance (Kwa'nantš),,voice|drum,True,True,True,G major,,,120,1.0,2/4|3/4,,Frances Densmore,,1914,1916,densmore1922ute,book,Northern Ute Music,Frances Densmore,1922,177.0,95.0,,736,https://books.google.nl/books?id=fEhAAAAAYAAJ&hl=nl&pg=PA177.0,Daniel Shanahan|Eva Shanahan,2014,,Copyright 2014 Daniel and Eva Shanahan,,data/No_95_Hand_Game_Song_(b).krn,kern,,5a55c8ea247abaaf3805db50d183760c,https://github.com/shanahdt/densmore/blob/master/Densmore/northern_ute/None.krn,,True,True,,"{""meta.singer_num"": 7.0, ""meta.performer_band"": ""White River and Uinta"", ""meta.performer_age_group"": ""middle"", ""meta.genre"": ""hand game song"", ""meta.bpm_voice"": ""120"", ""meta.bpm_drum"": 120.0, ""file.SOCIAL_FUNCTION"": ""hand game songs"", ""file.REG"": ""Southwest"", ""file.LANG"": ""Non-Tone"", ""file.LING_GROUP"": ""Uto-Aztecan""}",,,"This, like the preceding song, contains a sliding upward tone and also short rests. (See No. 8.) The rhythmic unit furnishes the chief interest of the song, occurring three times on the same tones. The song is harmonic in structure and has a compass of six tones. Although the compass is so small the interval of a fifth occurs twice.",,
