id,dataset_id,corpus_version,title,title_translation,location,latitude,longitude,auto_geocoded,language,glottolog_id,culture,culture_dplace_id,culture_hraf_id,genres,performers,performer_genders,instrumentation,instrument_use,percussion_use,voice_use,tonality,scale,ambitus,tempo,beat_duration,meters,metric_classification,collectors,collection_date,collection_date_earliest,collection_date_latest,publication_key,publication_type,publication_title,publication_authors,publication_date,publication_page_num,publication_song_num,tune_family_id,catalogue_num,publication_preview_url,encoders,encoding_date,contributors,copyright,license_id,file_path,file_format,version,file_checksum,file_url,file_preview_url,file_has_lyrics,file_has_music,file_has_licence,other_fields,comments,warnings,description,lyrics,lyrics_translation
ute065,densmore-northern-ute,0.0.1,Song Used in Treatment of Sick (n),,"Whiterocks, Utah",40.4675,-109.929722,False,Ute,utee1244,Ute,Nd58,NT19,healing,Mrs. Washington (Sa'kwiagant),female,voice,,,True,B flat major,,,88,1.0,2/4|3/4,,Frances Densmore,,1914,1916,densmore1922ute,book,Northern Ute Music,Frances Densmore,1922,138.0,65.0,,756,https://books.google.nl/books?id=fEhAAAAAYAAJ&hl=nl&pg=PA138.0,Daniel Shanahan|Eva Shanahan,2014,,Copyright 2014 Daniel and Eva Shanahan,,data/No_65_Song_Used_in_Treatment_of_Sick_(n).krn,kern,,6883e5b353a8fd3659bff27a6350cf15,https://github.com/shanahdt/densmore/blob/master/Densmore/northern_ute/None.krn,,True,True,,"{""meta.singer_num"": 25.0, ""meta.performer_band"": ""White River and Uinta"", ""meta.performer_age_group"": ""middle"", ""meta.genre"": ""treatment of sick"", ""meta.bpm_voice"": ""88"", ""meta.bpm_drum"": NaN, ""file.SOCIAL_FUNCTION"": ""songs used in the treatment of the sick"", ""file.REG"": ""Southwest"", ""file.LANG"": ""Non-Tone"", ""file.LING_GROUP"": ""Uto-Aztecan""}","""Drum not recorded""",,,,
ute066,densmore-northern-ute,0.0.1,Song Used in Treatment of Sick (o),,"Whiterocks, Utah",40.4675,-109.929722,False,Ute,utee1244,Ute,Nd58,NT19,healing,Mrs. Washington (Sa'kwiagant),female,voice,,,True,B flat major,,,66,1.0,2/4|3/4,,Frances Densmore,,1914,1916,densmore1922ute,book,Northern Ute Music,Frances Densmore,1922,139.0,66.0,,757,https://books.google.nl/books?id=fEhAAAAAYAAJ&hl=nl&pg=PA139.0,Daniel Shanahan|Eva Shanahan,2014,,Copyright 2014 Daniel and Eva Shanahan,,data/No_66_Song_Used_in_Treatment_of_Sick_(o).krn,kern,,ee7f99fe158198a6337a2536a90e50f4,https://github.com/shanahdt/densmore/blob/master/Densmore/northern_ute/None.krn,,True,True,,"{""meta.singer_num"": 25.0, ""meta.performer_band"": ""White River and Uinta"", ""meta.performer_age_group"": ""middle"", ""meta.genre"": ""treatment of sick"", ""meta.bpm_voice"": ""66"", ""meta.bpm_drum"": NaN, ""file.SOCIAL_FUNCTION"": ""songs used in the treatment of the sick"", ""file.REG"": ""Southwest"", ""file.LANG"": ""Non-Tone"", ""file.LING_GROUP"": ""Uto-Aztecan""}","""Drum not recorded""",,,,
ute067,densmore-northern-ute,0.0.1,War Song (a),,"Whiterocks, Utah",40.4675,-109.929722,False,Ute,utee1244,Ute,Nd58,NT19,war,Little Jim (To'pātšuk),male,voice|drum,True,True,True,D flat major,,,126,1.0,2/4|3/4,,Frances Densmore,,1914,1916,densmore1922ute,book,Northern Ute Music,Frances Densmore,1922,147.0,67.0,,759,https://books.google.nl/books?id=fEhAAAAAYAAJ&hl=nl&pg=PA147.0,Daniel Shanahan|Eva Shanahan,2014,,Copyright 2014 Daniel and Eva Shanahan,,data/No_67_War_Song_(a).krn,kern,,f8b86b191edbb8fa97bf951b89f752cf,https://github.com/shanahdt/densmore/blob/master/Densmore/northern_ute/None.krn,,True,True,,"{""meta.singer_num"": 1.0, ""meta.performer_band"": ""White River and Uinta"", ""meta.performer_age_group"": ""old"", ""meta.genre"": ""war song"", ""meta.bpm_voice"": ""126"", ""meta.bpm_drum"": 126.0, ""file.SOCIAL_FUNCTION"": ""war songs"", ""file.REG"": ""Southwest"", ""file.LANG"": ""Non-Tone"", ""file.LING_GROUP"": ""Uto-Aztecan""}",,,"This song is on the fourth five-toned scale with D flat as its keynote. In structure it is melodic with harmonic framework. The rhythmic unit comprises three measures. Attention is directed to the ninth, tenth, and eleventh measures, which bear a close resem blance to the rhythmic unit, but were sung with a different accent and phrasing. The half note in the ninth measure was sung as the close of the preceding phrase, the tenth measure was begun with an accent, and the eleventh measure given two quarter notes instead of one half note. This distinction was clearly given in all renditions of the song.",,
ute068,densmore-northern-ute,0.0.1,War Song (b),,"Whiterocks, Utah",40.4675,-109.929722,False,Ute,utee1244,Ute,Nd58,NT19,war,Charlie Saritch (Sa'ritš),male,voice,,,True,D major,,,84,1.0,3/4|2/4,,Frances Densmore,,1914,1916,densmore1922ute,book,Northern Ute Music,Frances Densmore,1922,148.0,68.0,,704,https://books.google.nl/books?id=fEhAAAAAYAAJ&hl=nl&pg=PA148.0,Daniel Shanahan|Eva Shanahan,2014,,Copyright 2014 Daniel and Eva Shanahan,,data/No_68_War_Song_(b).krn,kern,,cc2ccc40002d7cdf57601e581da22220,https://github.com/shanahdt/densmore/blob/master/Densmore/northern_ute/None.krn,,True,True,,"{""meta.singer_num"": 9.0, ""meta.performer_band"": ""White River and Uinta"", ""meta.performer_age_group"": ""middle"", ""meta.genre"": ""war song"", ""meta.bpm_voice"": ""84"", ""meta.bpm_drum"": NaN, ""file.SOCIAL_FUNCTION"": ""war songs"", ""file.REG"": ""Southwest"", ""file.LANG"": ""Non-Tone"", ""file.LING_GROUP"": ""Uto-Aztecan""}","""Drum not recorded""",,"This melody is simple in form, has a compass of an octave, and contains the tones of the fourth five-toned scale. It begins on the octave, and ends on the tonic, about two-thirds of the progressions being downward. In structure it is melodic. No rhythmic unit occurs and the song as a whole has not a decided rhythm. For other songs containing rests see No. 8.",,
ute069,densmore-northern-ute,0.0.1,War Song (c),,"Whiterocks, Utah",40.4675,-109.929722,False,Ute,utee1244,Ute,Nd58,NT19,war,Tim Johnson,male,voice|drum,True,True,True,D flat major,,,80,1.0,2/4|3/4,,Frances Densmore,,1914,1916,densmore1922ute,book,Northern Ute Music,Frances Densmore,1922,148.0,69.0,,723,https://books.google.nl/books?id=fEhAAAAAYAAJ&hl=nl&pg=PA148.0,Daniel Shanahan|Eva Shanahan,2014,,Copyright 2014 Daniel and Eva Shanahan,,data/No_69_War_Song_(c).krn,kern,,593504981f3dc81dddcd8bcc31d773cf,https://github.com/shanahdt/densmore/blob/master/Densmore/northern_ute/None.krn,,True,True,,"{""meta.singer_num"": 16.0, ""meta.performer_band"": ""White River and Uinta"", ""meta.performer_age_group"": ""old"", ""meta.genre"": ""war song"", ""meta.bpm_voice"": ""80"", ""meta.bpm_drum"": 80.0, ""file.SOCIAL_FUNCTION"": ""war songs"", ""file.REG"": ""Southwest"", ""file.LANG"": ""Non-Tone"", ""file.LING_GROUP"": ""Uto-Aztecan""}",,,"Several renditions of this song were recorded and show no material variation. This is interesting to note, as the two rhythmic units differ only in the division of the final count. The song is on the fourth five-toned scale and has a compass of an octave. The fourth is a prominent interval, comprising more than a fourth of the entire number of progressions. The association of this interval with songs concerning motion has been frequently noted. This song resembles the song next following so closely as to suggest an unintentional duplication.",,
ute070,densmore-northern-ute,0.0.1,War Song (d),,"Whiterocks, Utah",40.4675,-109.929722,False,Ute,utee1244,Ute,Nd58,NT19,war,Dave Weetch (Witš),,voice|drum,True,True,True,D flat major,,,88|80,1.0,2/4|3/4,,Frances Densmore,,1914,1916,densmore1922ute,book,Northern Ute Music,Frances Densmore,1922,149.0,70.0,,792,https://books.google.nl/books?id=fEhAAAAAYAAJ&hl=nl&pg=PA149.0,Daniel Shanahan|Eva Shanahan,2014,,Copyright 2014 Daniel and Eva Shanahan,,data/No_70_War_Song_(d).krn,kern,,5f2afc3aabb14fbccc9b80b76f1b22fa,https://github.com/shanahdt/densmore/blob/master/Densmore/northern_ute/None.krn,,True,True,,"{""meta.singer_num"": 19.0, ""meta.performer_band"": ""White River and Uinta"", ""meta.performer_age_group"": ""middle"", ""meta.genre"": ""war song"", ""meta.bpm_voice"": ""88"", ""meta.bpm_drum"": 80.0, ""file.SOCIAL_FUNCTION"": ""war songs"", ""file.REG"": ""Southwest"", ""file.LANG"": ""Non-Tone"", ""file.LING_GROUP"": ""Uto-Aztecan""}",,,"Between the renditions of this song there was sung a brief connective phrase which is represented in the transcription by two half notes, but which was sung with various divisions of the count. It is of interest as showing the manner in which the Utes frequently break the ascent of an octave in repeating a song. This is contrasted with the customs of the Sioux and Chippewa, who fre quently make the direct ascent of an octave or a twelfth in repeating a song. Songs having a connective phrase are noted in the analysis of No. 7. This song is divided rhythmically into two parts, which are alike except for the fifth measure. It will be readily noted that no measure corresponding to this appears after the rhythmic units in the second portion of the song. Another slight difference is that the first part ends in 3-A and the second in 2-4 time. The tempo of the drum was not strictly maintained, but was slightly slower than the voice throughout the renditions. --The melody is on the fourth five-toned scale, and about three-fourths of the intervals are descending progres sions.",,
ute071,densmore-northern-ute,0.0.1,Scout Song,,"Whiterocks, Utah",40.4675,-109.929722,False,Ute,utee1244,Ute,Nd58,NT19,war,Tim Johnson,male,voice,,,True,G sharp minor,,,72,1.0,2/4|3/4,,Frances Densmore,,1914,1916,densmore1922ute,book,Northern Ute Music,Frances Densmore,1922,150.0,71.0,,724,https://books.google.nl/books?id=fEhAAAAAYAAJ&hl=nl&pg=PA150.0,Daniel Shanahan|Eva Shanahan,2014,,Copyright 2014 Daniel and Eva Shanahan,,data/No_71_Scout_Song.krn,kern,,dc3291290c1831b8ce2d9b643457231a,https://github.com/shanahdt/densmore/blob/master/Densmore/northern_ute/None.krn,,True,True,,"{""meta.singer_num"": 16.0, ""meta.performer_band"": ""White River and Uinta"", ""meta.performer_age_group"": ""old"", ""meta.genre"": ""war song"", ""meta.bpm_voice"": ""72"", ""meta.bpm_drum"": NaN, ""file.SOCIAL_FUNCTION"": ""war songs"", ""file.REG"": ""Southwest"", ""file.LANG"": ""Non-Tone"", ""file.LING_GROUP"": ""Uto-Aztecan""}","""Drum not recorded""",,"This song contains only the tones of the minor triad and seventh, a tone-material which is considered in the analysis of No. 38. Throughout the rendition of this song the tone was firm and the intonation good. The descent of a seventh in two intervals, occurring in the rhythmic unit, is effective and is barbaric in character. The intervals are large, and only 19 progressions occur in the song. The tempo is quite slow. The interval of a fifth is prominent in this song, 42 per cent of the progressions being fifths.",,There is no one near.
ute072,densmore-northern-ute,0.0.1,War Song (e),,"Whiterocks, Utah",40.4675,-109.929722,False,Ute,utee1244,Ute,Nd58,NT19,war,Charlie Saritch (Sa'ritš),male,voice|drum,True,True,True,A flat major,,,126,0.5,3/8|2/8,,Frances Densmore,,1914,1916,densmore1922ute,book,Northern Ute Music,Frances Densmore,1922,151.0,72.0,,705,https://books.google.nl/books?id=fEhAAAAAYAAJ&hl=nl&pg=PA151.0,Daniel Shanahan|Eva Shanahan,2014,,Copyright 2014 Daniel and Eva Shanahan,,data/No_72_War_Song_(e).krn,kern,,193453e47ce4eb90fe5305b4c4d3843d,https://github.com/shanahdt/densmore/blob/master/Densmore/northern_ute/None.krn,,True,True,,"{""meta.singer_num"": 9.0, ""meta.performer_band"": ""White River and Uinta"", ""meta.performer_age_group"": ""middle"", ""meta.genre"": ""war song"", ""meta.bpm_voice"": ""126"", ""meta.bpm_drum"": 63.0, ""file.SOCIAL_FUNCTION"": ""war songs"", ""file.REG"": ""Southwest"", ""file.LANG"": ""Non-Tone"", ""file.LING_GROUP"": ""Uto-Aztecan""}",The metronome mark for the drum is quarter=63,,"Instead of a uniform drumbeat throughout the song, we have in this instance a very rapid drumbeat in the opening meas ures, followed by a quarter-note rhythm. Other songs with the same peculiarity are Nos. 86, 87, and 88. This seems an individual phase rather than one connected with the character of the song. The quarter-note drumbeat was maintained steadily during the 3-8 measures of the song and synchronized occasionally with the voice. Only one other song (No. 22) begins in 3-8 time. In the fourth and fifth renditions the singer interpolated sharp, shrill cries before the connective phrase. (See No. 7.) The melody contains the tones of the fourth five-toned scale and is melodic in structure. Only one- fourth of the intervals are larger than a minor third.",,
ute073,densmore-northern-ute,0.0.1,War Song (f),,"Whiterocks, Utah",40.4675,-109.929722,False,Ute,utee1244,Ute,Nd58,NT19,war,John Star (Sa'vawitopatš),male,voice,,,True,C major,,,76,1.0,2/4|3/4|4/4,,Frances Densmore,,1914,1916,densmore1922ute,book,Northern Ute Music,Frances Densmore,1922,152.0,73.0,,747,https://books.google.nl/books?id=fEhAAAAAYAAJ&hl=nl&pg=PA152.0,Daniel Shanahan|Eva Shanahan,2014,,Copyright 2014 Daniel and Eva Shanahan,,data/No_73_War_Song_(f).krn,kern,,69277c4fae6481b83edce7928ed7e948,https://github.com/shanahdt/densmore/blob/master/Densmore/northern_ute/None.krn,,True,True,,"{""meta.singer_num"": 18.0, ""meta.performer_band"": ""White River and Uinta"", ""meta.performer_age_group"": ""old"", ""meta.genre"": ""war song"", ""meta.bpm_voice"": ""76"", ""meta.bpm_drum"": NaN, ""file.SOCIAL_FUNCTION"": ""war songs"", ""file.REG"": ""Southwest"", ""file.LANG"": ""Non-Tone"", ""file.LING_GROUP"": ""Uto-Aztecan""}","""Drum not recorded""",,"Two renditions of this song were recorded with prac tically no variations. In both renditions the second count in the second measure was sung as two eighth notes, thus differentiating it from the rhythmic unit in which the corresponding count is sung as a quarter note. Neither are the divisions of the last count like those in the following measure. Only about one-eighth of the intervals are larger than a major third, and more than half are major and minor seconds. (See No. 28.) The song has a compass of an octave.",,
ute074,densmore-northern-ute,0.0.1,Parade of Returning Warriors,,"Whiterocks, Utah",40.4675,-109.929722,False,Ute,utee1244,Ute,Nd58,NT19,war,John Star (Sa'vawitopatš),male,voice|drum,True,True,True,G flat major,,,66,1.0,2/4|3/4,,Frances Densmore,,1914,1916,densmore1922ute,book,Northern Ute Music,Frances Densmore,1922,153.0,74.0,,748,https://books.google.nl/books?id=fEhAAAAAYAAJ&hl=nl&pg=PA153.0,Daniel Shanahan|Eva Shanahan,2014,,Copyright 2014 Daniel and Eva Shanahan,,data/No_74_Parade_of_Returning_Warriors.krn,kern,,2bf35e7ab9aea5f7d1ecfcb3733bba2c,https://github.com/shanahdt/densmore/blob/master/Densmore/northern_ute/None.krn,,True,True,,"{""meta.singer_num"": 18.0, ""meta.performer_band"": ""White River and Uinta"", ""meta.performer_age_group"": ""old"", ""meta.genre"": ""war song"", ""meta.bpm_voice"": ""66"", ""meta.bpm_drum"": 66.0, ""file.SOCIAL_FUNCTION"": ""war songs"", ""file.REG"": ""Southwest"", ""file.LANG"": ""Non-Tone"", ""file.LING_GROUP"": ""Uto-Aztecan""}",,,"This song is on the fourth five-toned scale with G flat as its keynote. Two renditions were recorded, each containing a repeated portion as indicated in the transcription. Two rhythmic units occur, the difference between them being slight but clearly given by the singer. The song is melodic in structure, and almost half the intervals are major seconds.",,
ute075,densmore-northern-ute,0.0.1,War Song (g),,"Whiterocks, Utah",40.4675,-109.929722,False,Ute,utee1244,Ute,Nd58,NT19,war,John Star (Sa'vawitopatš),male,voice|drum,True,True,True,B major,,,63,1.0,2/4|3/4,,Frances Densmore,,1914,1916,densmore1922ute,book,Northern Ute Music,Frances Densmore,1922,154.0,75.0,,749,https://books.google.nl/books?id=fEhAAAAAYAAJ&hl=nl&pg=PA154.0,Daniel Shanahan|Eva Shanahan,2014,,Copyright 2014 Daniel and Eva Shanahan,,data/No_75_War_Song_(g).krn,kern,,655fb6095a2ccd50a852416f71026bfd,https://github.com/shanahdt/densmore/blob/master/Densmore/northern_ute/None.krn,,True,True,,"{""meta.singer_num"": 18.0, ""meta.performer_band"": ""White River and Uinta"", ""meta.performer_age_group"": ""old"", ""meta.genre"": ""war song"", ""meta.bpm_voice"": ""63"", ""meta.bpm_drum"": 63.0, ""file.SOCIAL_FUNCTION"": ""war songs"", ""file.REG"": ""Southwest"", ""file.LANG"": ""Non-Tone"", ""file.LING_GROUP"": ""Uto-Aztecan""}",,,"This song is characterized by a compass of 12 tones, which is unusual in this series. The song contains no change of time, differing in this respect from a majority of the present songs. The rhythmic unit is interesting and occurs seven times. As cending and descending intervals are almost equal in number, the song containing 10 ascending and 10 descending major thirds. The melody contains only the tones of the major triad.",,
ute076,densmore-northern-ute,0.0.1,Song When Washing the Wounded (a),,"Whiterocks, Utah",40.4675,-109.929722,False,Ute,utee1244,Ute,Nd58,NT19,war,Tim Johnson,male,voice,,,True,E flat major,,,84,1.0,3/4|2/4,,Frances Densmore,,1914,1916,densmore1922ute,book,Northern Ute Music,Frances Densmore,1922,155.0,76.0,,725,https://books.google.nl/books?id=fEhAAAAAYAAJ&hl=nl&pg=PA155.0,Daniel Shanahan|Eva Shanahan,2014,,Copyright 2014 Daniel and Eva Shanahan,,data/No_76_Song_When_Washing_the_Wounded_(a).krn,kern,,b95bdd7a1b06087110e9bc35e25f289a,https://github.com/shanahdt/densmore/blob/master/Densmore/northern_ute/None.krn,,True,True,,"{""meta.singer_num"": 16.0, ""meta.performer_band"": ""White River and Uinta"", ""meta.performer_age_group"": ""old"", ""meta.genre"": ""war song"", ""meta.bpm_voice"": ""84"", ""meta.bpm_drum"": NaN, ""file.SOCIAL_FUNCTION"": ""war songs"", ""file.REG"": ""Southwest"", ""file.LANG"": ""Non-Tone"", ""file.LING_GROUP"": ""Uto-Aztecan""}","""Drum not recorded""",,"A peculiarity of this song is the measure in slower time, this change in tempo being the same in all renditions. (See No. 11.) The phrasing was clearly given throughout the song. Sixty per cent of the intervals are minor thirds, about equally divided between ascending and descending progressions. The song contains only the tones of the major triad and sixth.",,
ute077,densmore-northern-ute,0.0.1,Song When Washing the Wounded (b),,"Whiterocks, Utah",40.4675,-109.929722,False,Ute,utee1244,Ute,Nd58,NT19,war,Charlie Saritch (Sa'ritš),male,voice,,,True,G sharp minor,,,104,1.0,2/4|5/4|3/4,,Frances Densmore,,1914,1916,densmore1922ute,book,Northern Ute Music,Frances Densmore,1922,155.0,77.0,,706,https://books.google.nl/books?id=fEhAAAAAYAAJ&hl=nl&pg=PA155.0,Daniel Shanahan|Eva Shanahan,2014,,Copyright 2014 Daniel and Eva Shanahan,,data/No_77_Song_When_Washing_the_Wounded_(b).krn,kern,,979168940f9ce366413152de2ebb427c,https://github.com/shanahdt/densmore/blob/master/Densmore/northern_ute/None.krn,,True,True,,"{""meta.singer_num"": 9.0, ""meta.performer_band"": ""White River and Uinta"", ""meta.performer_age_group"": ""middle"", ""meta.genre"": ""war song"", ""meta.bpm_voice"": ""104"", ""meta.bpm_drum"": NaN, ""file.SOCIAL_FUNCTION"": ""war songs"", ""file.REG"": ""Southwest"", ""file.LANG"": ""Non-Tone"", ""file.LING_GROUP"": ""Uto-Aztecan""}","""Drum not recorded""",,"This song was recorded by the same singer at two differ ent times, thus affording an interesting opportunity for observing the accuracy with which the song was repeated. (Cf. Nos. 39 and 78.) Six renditions were recorded in 1914, the renditions being uniform and connected without a break in the time. The transcrip tion is from the cylinder made in 1914. Five renditions of the same song were recorded in 1916, at which time the writer did not play, the first record, but ""hummed"" the transcription. The singer recog nized it and said he would like to make another record of it. This second cylinder was transcribed and the results compared. In this comparison it is found that all the renditions recorded in 1916 omit the fifth and sixth measures and the last measure of the song as transcribed. As these measures are repetitions, this would be of slight importance, but as it reduces the occurrences of these phrases from three to two the change suggests a tendency toward regularity and conventionality. The first group of renditions was in a tempo of quarter = 104, and the key of G minor: the second was faster (quarter =108) but in a lower key—the key of F sharp minor. The 5-4 division of certain measures was strictly maintained. The song contains the tones of the second five-toned scale and is melodic in structure. Considering the lack of variety in progressions the melody is inter esting and quite diversified. One-half the intervals are minor thirds, and of the other half all except one interval are major seconds, that interval being an ascending fourth. Other songs containing rests are noted in the analysis of No. 8.",,
ute078,densmore-northern-ute,0.0.1,Scalp Dance Song (a),,"Whiterocks, Utah",40.4675,-109.929722,False,Ute,utee1244,Ute,Nd58,NT19,war,Little Jim (To'pātšuk),male,voice,,,True,E flat minor,,,96,1.0,3/4|2/4,,Frances Densmore,,1914,1916,densmore1922ute,book,Northern Ute Music,Frances Densmore,1922,157.0,78.0,,760,https://books.google.nl/books?id=fEhAAAAAYAAJ&hl=nl&pg=PA157.0,Daniel Shanahan|Eva Shanahan,2014,,Copyright 2014 Daniel and Eva Shanahan,,data/No_78_Scalp_Dance_Song_(a).krn,kern,,4c9ae308f59d10d836e523e01e3a68ae,https://github.com/shanahdt/densmore/blob/master/Densmore/northern_ute/None.krn,,True,True,,"{""meta.singer_num"": 1.0, ""meta.performer_band"": ""White River and Uinta"", ""meta.performer_age_group"": ""old"", ""meta.genre"": ""war song"", ""meta.bpm_voice"": ""96"", ""meta.bpm_drum"": NaN, ""file.SOCIAL_FUNCTION"": ""war songs"", ""file.REG"": ""Southwest"", ""file.LANG"": ""Non-Tone"", ""file.LING_GROUP"": ""Uto-Aztecan""}","""Drum not recorded""",,"This song was twice recorded by the same singer, only one of the records being transcribed (cf. Nos. 39 and 77). The repetition arose from an impression frequently noted among the Indians, that if the words are changed in a melody it becomes a different song. Thus, in the first instance, the singer said this was a song which he sang in the war dance when he brought home a captive woman, and, in the second instance, he said it was a scalp dance song. The words were not taken in either rendition.
A comparison of the two cylinders shows the pitch of the rendi tions to be the same. Five repetitions of the song were recorded the first time and six the second time. The differences in these 11 renditions are too slight to be of importance. In the first group the opening phrase was occasionally repeated, and in the second group the ending was occasionally changed in rhythm, and the fifth measure (last two counts) contained quarter in place of eighth notes. Passing from this comparison to an analysis of the transcription, we note that the melody contains only the tones of the minor triad and fourth and in structure is melodic with harmonic framework. More than half the intervate are minor thirds, a majority of the remainder being major seconds.",,
ute079,densmore-northern-ute,0.0.1,Scalp Dance Song (b),,"Whiterocks, Utah",40.4675,-109.929722,False,Ute,utee1244,Ute,Nd58,NT19,war,John Star (Sa'vawitopatš),male,voice|drum,True,True,True,F minor,,,66,1.0,2/4|3/4,,Frances Densmore,,1914,1916,densmore1922ute,book,Northern Ute Music,Frances Densmore,1922,158.0,79.0,,750,https://books.google.nl/books?id=fEhAAAAAYAAJ&hl=nl&pg=PA158.0,Daniel Shanahan|Eva Shanahan,2014,,Copyright 2014 Daniel and Eva Shanahan,,data/No_79_Scalp_Dance_Song_(b).krn,kern,,f00226e332c2b75bbba682e23e8b385c,https://github.com/shanahdt/densmore/blob/master/Densmore/northern_ute/None.krn,,True,True,,"{""meta.singer_num"": 18.0, ""meta.performer_band"": ""White River and Uinta"", ""meta.performer_age_group"": ""old"", ""meta.genre"": ""war song"", ""meta.bpm_voice"": ""66"", ""meta.bpm_drum"": NaN, ""file.SOCIAL_FUNCTION"": ""war songs"", ""file.REG"": ""Southwest"", ""file.LANG"": ""Non-Tone"", ""file.LING_GROUP"": ""Uto-Aztecan""}",,,"Considering F to be the keynote of this song, we find the tone material to comprise the keynote, third, and fourth. The structure of the song shows, however, what has been termed an ""interval-formation"" rather than a key-relation of the several tones. (See Bull. 53, pp. 7, 8.) Thus the first portion, and in every instance the rhythmic unit, is on the fifth (B flat-F), while the middle and closing measures are on the minor third (F-A flat). The intervals are larger than in a majority of these songs, about one-fourth of them being fifths. The. major second comprises only about one- sixth of the total number. Drum and voice have the same tune unit, but because of slight variations in tempo they seldom coincide for more than a few measures.",,
