id,dataset_id,corpus_version,title,title_translation,location,latitude,longitude,auto_geocoded,language,glottolog_id,culture,culture_dplace_id,culture_hraf_id,genres,performers,performer_genders,instrumentation,instrument_use,percussion_use,voice_use,tonality,scale,ambitus,tempo,beat_duration,meters,metric_classification,collectors,collection_date,collection_date_earliest,collection_date_latest,publication_key,publication_type,publication_title,publication_authors,publication_date,publication_page_num,publication_song_num,tune_family_id,catalogue_num,publication_preview_url,encoders,encoding_date,contributors,copyright,license_id,file_path,file_format,version,file_checksum,file_url,file_preview_url,file_has_lyrics,file_has_music,file_has_licence,other_fields,comments,warnings,description,lyrics,lyrics_translation
ute031,densmore-northern-ute,0.0.1,Turkey Dance Song (b),,"Whiterocks, Utah",40.4675,-109.929722,False,Ute,utee1244,Ute,Nd58,NT19,dance|animal,Quinance (Kwa'nantš),,voice|drum,True,True,True,F sharp minor,,,104,1.0,2/4|3/4,,Frances Densmore,,1914,1916,densmore1922ute,book,Northern Ute Music,Frances Densmore,1922,98.0,31.0,,732,https://books.google.nl/books?id=fEhAAAAAYAAJ&hl=nl&pg=PA98.0,Daniel Shanahan|Eva Shanahan,2014,,Copyright 2014 Daniel and Eva Shanahan,,data/No_31_Turkey_Dance_Song_(b).krn,kern,,4a6b25e88880f44536123abc18e242fd,https://github.com/shanahdt/densmore/blob/master/Densmore/northern_ute/None.krn,,True,True,,"{""meta.singer_num"": 7.0, ""meta.performer_band"": ""White River and Uinta"", ""meta.performer_age_group"": ""middle"", ""meta.genre"": ""turkey dance"", ""meta.bpm_voice"": ""104"", ""meta.bpm_drum"": 104.0, ""file.SOCIAL_FUNCTION"": ""songs of the turkey dance"", ""file.REG"": ""Southwest"", ""file.LANG"": ""Non-Tone"", ""file.LING_GROUP"": ""Uto-Aztecan""}",Drum rhythm similar to No. 30 (eighth notes),,"This song resembles the preceding song in melodic structure, though differing widely from it in rhythm. Eighty-four per cent of the progressions contain two or three semitones, yet the song has a compass of 10 tones. Ascending and descending pro gressions are singularly uniform, there being in ascending progression 1 fourth, 3 minor thirds, and 3 major seconds, while the descending progressions comprise 2 fourths, 5 major thirds, and 5 major seconds. The tone material is that of the second five-toned scale. The inter rupted drumbeat, noted in the preceding song, is present in this phonograph record but is not transcribed.",,
ute032,densmore-northern-ute,0.0.1,Turkey Dance Song (c),,"Whiterocks, Utah",40.4675,-109.929722,False,Ute,utee1244,Ute,,NT19,dance|animal,Joshua Washington (Pa'tšatš),male,voice|drum,True,True,True,B major,,,96,1.0,2/4|3/4,,Frances Densmore,,1914,1916,densmore1922ute,book,Northern Ute Music,Frances Densmore,1922,99.0,32.0,,741,https://books.google.nl/books?id=fEhAAAAAYAAJ&hl=nl&pg=PA99.0,Daniel Shanahan|Eva Shanahan,2014,,Copyright 2014 Daniel and Eva Shanahan,,data/No_32_Turkey_Dance_Song_(c).krn,kern,,cbd25d234da331bcfd07aa6e68fe5721,https://github.com/shanahdt/densmore/blob/master/Densmore/northern_ute/None.krn,,True,True,,"{""meta.singer_num"": 6.0, ""meta.performer_band"": NaN, ""meta.performer_age_group"": ""young"", ""meta.genre"": ""turkey dance"", ""meta.bpm_voice"": ""96"", ""meta.bpm_drum"": 96.0, ""file.SOCIAL_FUNCTION"": ""songs of the turkey dance"", ""file.REG"": ""Southwest"", ""file.LANG"": ""Non-Tone"", ""file.LING_GROUP"": ""Uto-Aztecan""}",Drum rhythm similar to No. 30 (eighth notes),,"The downward trend of this song, following the inter vals of the tonic chord, is emphasized by a glissando of the voice, indicated in the transcription. The melody contains only the tones of the major triad and second. It has a compass of 11 tones and a majority of the progressions are minor thirds. No ascending pro gressions occur between accented tones. (See plot, fig. 4.) Repe titions of the rhythmic unit comprise the entire melody except the closing measures.",,
ute033,densmore-northern-ute,0.0.1,Turkey Dance Song (d),,"Whiterocks, Utah",40.4675,-109.929722,False,Ute,utee1244,Ute,,NT19,dance|animal,Joshua Washington (Pa'tšatš),male,voice|drum,True,True,True,irregular,,,80,1.0,3/4|2/4,,Frances Densmore,,1914,1916,densmore1922ute,book,Northern Ute Music,Frances Densmore,1922,99.0,33.0,,742,https://books.google.nl/books?id=fEhAAAAAYAAJ&hl=nl&pg=PA99.0,Daniel Shanahan|Eva Shanahan,2014,,Copyright 2014 Daniel and Eva Shanahan,,data/No_33_Turkey_Dance_Song_(d).krn,kern,,54194871b7f73a74120b5878316a2d5f,https://github.com/shanahdt/densmore/blob/master/Densmore/northern_ute/None.krn,,True,True,,"{""meta.singer_num"": 6.0, ""meta.performer_band"": NaN, ""meta.performer_age_group"": ""young"", ""meta.genre"": ""turkey dance"", ""meta.bpm_voice"": ""80"", ""meta.bpm_drum"": 88.0, ""file.SOCIAL_FUNCTION"": ""songs of the turkey dance"", ""file.REG"": ""Southwest"", ""file.LANG"": ""Non-Tone"", ""file.LING_GROUP"": ""Uto-Aztecan""}",Drum rhythm similar to No. 30 (eighth notes),,"The progressions of this melody suggest E flat as a keynote, but G (the third) is not present and the melody is not classified in tonality or key. Another song of the present series lacking the third is No. 37. (See Bull. 53, p. 140, and Bull. 61, p. 135.) The interval of a fourth constitutes 22 per cent of the progressions, the remaining intervals, with one exception, being major and minor thirds. Two rhythmic periods comprise the entire song, a short rhythmic unit occurring in both periods. The drum is slightly faster than the voice and steadily maintained in the five renditions.",,
ute034,densmore-northern-ute,0.0.1,Turkey Dance Song (e),,"Whiterocks, Utah",40.4675,-109.929722,False,Ute,utee1244,Ute,Nd62,NT19,dance|animal,Chigoop (Tšigu'p),,voice|drum,True,True,True,B major,,,76,1.0,3/4,,Frances Densmore,,1914,1916,densmore1922ute,book,Northern Ute Music,Frances Densmore,1922,100.0,34.0,,790,https://books.google.nl/books?id=fEhAAAAAYAAJ&hl=nl&pg=PA100.0,Daniel Shanahan|Eva Shanahan,2014,,Copyright 2014 Daniel and Eva Shanahan,,data/No_34_Turkey_Dance_Song_(e).krn,kern,,4bd8f651613140a488f40e4b090ce3b6,https://github.com/shanahdt/densmore/blob/master/Densmore/northern_ute/None.krn,,True,True,,"{""meta.singer_num"": 15.0, ""meta.performer_band"": ""Uncompahgre"", ""meta.performer_age_group"": ""old"", ""meta.genre"": ""turkey dance"", ""meta.bpm_voice"": ""76"", ""meta.bpm_drum"": 76.0, ""file.SOCIAL_FUNCTION"": ""songs of the turkey dance"", ""file.REG"": ""Southwest"", ""file.LANG"": ""Non-Tone"", ""file.LING_GROUP"": ""Uto-Aztecan""}",Drum rhythm similar to No. 30 (eighth notes),,"In melodic structure this song comprises three parts: The first (3 measures) is based on the major triad B-D sharp-F sharp; the second (1 measure) on the minor triad G sharp-B-D sharp; and the third (4 measures) on the chord B-D.sharp-F sharp-B, the accented tones following the descending intervals of this chord. The song is thus seen to be strongly harmonic in character. No interval larger than a minor third occurs in the song, and about 58 per cent of the progressions are whole tones. (See No. 28.) The song has a compass of 13 tones and contains the entire octave except the seventh. Repetitions of the rhythmic unit comprise practically the entire song.",,
ute035,densmore-northern-ute,0.0.1,Turkey Dance Song (f),,"Whiterocks, Utah",40.4675,-109.929722,False,Ute,utee1244,Ute,Nd62,NT19,dance|animal,Chigoop (Tšigu'p),,voice,,,True,E major,,,72,1.0,2/4|3/4,,Frances Densmore,,1914,1916,densmore1922ute,book,Northern Ute Music,Frances Densmore,1922,100.0,35.0,,791,https://books.google.nl/books?id=fEhAAAAAYAAJ&hl=nl&pg=PA100.0,Daniel Shanahan|Eva Shanahan,2014,,Copyright 2014 Daniel and Eva Shanahan,,data/No_35_Turkey_Dance_Song_(f).krn,kern,,d7cc7ce3f72c64b1ca2a2adf75bef3dc,https://github.com/shanahdt/densmore/blob/master/Densmore/northern_ute/None.krn,,True,True,,"{""meta.singer_num"": 15.0, ""meta.performer_band"": ""Uncompahgre"", ""meta.performer_age_group"": ""old"", ""meta.genre"": ""turkey dance"", ""meta.bpm_voice"": ""72"", ""meta.bpm_drum"": NaN, ""file.SOCIAL_FUNCTION"": ""songs of the turkey dance"", ""file.REG"": ""Southwest"", ""file.LANG"": ""Non-Tone"", ""file.LING_GROUP"": ""Uto-Aztecan""}","""drum not recorded""",,This song is not rhythmic in character. It contains all the tones of the octave except the fourth and is harmonic in structure.,,
ute036,densmore-northern-ute,0.0.1,Woman's Dance Song (a),,"Whiterocks, Utah",40.4675,-109.929722,False,Ute,utee1244,Ute,Nd62,NT19,dance|women,Areev,male,voice|drum,True,True,True,B flat major,,,80,1.0,2/4|3/4,,Frances Densmore,,1914,1916,densmore1922ute,book,Northern Ute Music,Frances Densmore,1922,102.0,36.0,,779,https://books.google.nl/books?id=fEhAAAAAYAAJ&hl=nl&pg=PA102.0,Daniel Shanahan|Eva Shanahan,2014,,Copyright 2014 Daniel and Eva Shanahan,,data/No_36_Woman's_Dance_Song_(a).krn,kern,,4bc29f698d2991b00d6d1fd073c60a8f,https://github.com/shanahdt/densmore/blob/master/Densmore/northern_ute/None.krn,,True,True,,"{""meta.singer_num"": 8.0, ""meta.performer_band"": ""Uncompahgre"", ""meta.performer_age_group"": ""old"", ""meta.genre"": ""woman's dance"", ""meta.bpm_voice"": ""80"", ""meta.bpm_drum"": 80.0, ""file.SOCIAL_FUNCTION"": ""songs of the woman's dance"", ""file.REG"": ""Southwest"", ""file.LANG"": ""Non-Tone"", ""file.LING_GROUP"": ""Uto-Aztecan""}",,,"The rhythmic structure of this song is interesting. Two rhythmic units occur, the first containing three and the second two counts. After a repetition of the first rhythmic unit we note a measure suggesting the second unit, followed by a measure resem bling the first unit, this, in turn, followed by the second unit and its repetition. The first unit reappears and is followed by a measure bearing resemblances to both units, the song closing with three repetitions of the second unit. This intelligent use of thematic material indicates a degree of musical cultivation among the Utes. The melody has a compass of an octave and contains all the tones of the octave except the seventh. Whole tones comprise 84 per cent of the progressions. (See No. 28.)",,
ute037,densmore-northern-ute,0.0.1,Woman's Dance Song (b),,"Whiterocks, Utah",40.4675,-109.929722,False,Ute,utee1244,Ute,,NT19,dance|women,Joshua Washington (Pa'tšatš),male,voice|drum,True,True,True,irregular,,,80,1.0,2/4|3/4,,Frances Densmore,,1914,1916,densmore1922ute,book,Northern Ute Music,Frances Densmore,1922,103.0,37.0,,743,https://books.google.nl/books?id=fEhAAAAAYAAJ&hl=nl&pg=PA103.0,Daniel Shanahan|Eva Shanahan,2014,,Copyright 2014 Daniel and Eva Shanahan,,data/No_37_Woman's_Dance_Song_(b).krn,kern,,c780b10e93103e2f14109b2c09823027,https://github.com/shanahdt/densmore/blob/master/Densmore/northern_ute/None.krn,,True,True,,"{""meta.singer_num"": 6.0, ""meta.performer_band"": NaN, ""meta.performer_age_group"": ""young"", ""meta.genre"": ""woman's dance"", ""meta.bpm_voice"": ""80"", ""meta.bpm_drum"": 80.0, ""file.SOCIAL_FUNCTION"": ""songs of the woman's dance"", ""file.REG"": ""Southwest"", ""file.LANG"": ""Non-Tone"", ""file.LING_GROUP"": ""Uto-Aztecan""}",,,"This song contains the tones B flat, E flat, G natural, and A natural, suggesting the key of B flat major, yet the third of that key does not appear. (See No. 33.) The song begins with an ascending octave. Only one other Ute song has this initial interval (No. 91). Chippewa and Sioux songs with this peculiarity are noted in Bulletin 53, page 81, and Bulletin 61, page 343. It also begins and ends on the same tone. (See Nos. 42, 59, 91, and 97 of this series; also Bull. 53, p. 222, and Bull. 61, p. 257.) About one-third of the intervals are fourths. Two rhythmic units occur, the rhythm of the second unit being steadily different from that of the first unit. A first and second ending occurs also in the dupli cation No. 39 and in No. 48. 
This song is considered in the Appendix, pages 206-208.",,
ute038,densmore-northern-ute,0.0.1,Woman's Dance Song (c),,"Whiterocks, Utah",40.4675,-109.929722,False,Ute,utee1244,Ute,,NT19,dance|women,Joshua Washington (Pa'tšatš),male,voice|drum,True,True,True,G sharp minor,,,80,1.0,3/4|2/4,,Frances Densmore,,1914,1916,densmore1922ute,book,Northern Ute Music,Frances Densmore,1922,104.0,38.0,,744,https://books.google.nl/books?id=fEhAAAAAYAAJ&hl=nl&pg=PA104.0,Daniel Shanahan|Eva Shanahan,2014,,Copyright 2014 Daniel and Eva Shanahan,,data/No_38_Woman's_Dance_Song_(c).krn,kern,,2a99bfe2277a037155facc5de333e21b,https://github.com/shanahdt/densmore/blob/master/Densmore/northern_ute/None.krn,,True,True,,"{""meta.singer_num"": 6.0, ""meta.performer_band"": NaN, ""meta.performer_age_group"": ""young"", ""meta.genre"": ""woman's dance"", ""meta.bpm_voice"": ""80"", ""meta.bpm_drum"": 80.0, ""file.SOCIAL_FUNCTION"": ""songs of the woman's dance"", ""file.REG"": ""Southwest"", ""file.LANG"": ""Non-Tone"", ""file.LING_GROUP"": ""Uto-Aztecan""}",,,"This song contains only the tones of the minor triad and seventh. The only other Ute song containing this tone material is No. 71.
Concerning this characteristic among Chippewa songs, see Bulletin 45, page 142, and Bulletin 53, page 258; among the Sioux songs, see Bulletin 61, pages 184,337. This chord has been found in the music of the American Negro 18 and was noted by Prof. J. C. Fillmore in songs of the Nass River Indians living in British Columbia; also among the songs of the Dahomy collected by Prof. Fillmore at the World's Columbian Exposition in Chicago, 1892.
In the songs analyzed by the present writer this chord appears in two forms: (1) In songs of minor tonality it constitutes the tonic chord with seventh added, and (2) in songs of major tonality it constitutes the submediant chord with the dominant of the key added as its highest tone. It will be noted that in the first form the tonic triad appears as the lower and in the second form as the upper portion of the chord. The second is the more frequent form, as shown by the fact that 11 Chippewa songs are characterized by this chord and only three are minor in tonality. (See song No. 30.) In the song under analysis the tonic triad (G sharp, B-D sharp) forms the framework of the melody, the seventh being less prominent and occurring only twice. The rhythmic unit is short and its repe titions comprise all the song except the closing measures. Four renditions were recorded and show no differences except that in one rendition the opening phrase, before the repeated portion, was omitted. Major and minor thirds constitute 68 per cent of the progressions.",,
ute039,densmore-northern-ute,0.0.1,Lame Dance Song (a),,"Whiterocks, Utah",40.4675,-109.929722,False,Ute,utee1244,Ute,Nd58,NT19,dance,Charlie Saritch (Sa'ritš),male,voice|drum,True,True,True,E major,,,69,1.0,2/4|3/4,,Frances Densmore,,1914,1916,densmore1922ute,book,Northern Ute Music,Frances Densmore,1922,106.0,39.0,,701,https://books.google.nl/books?id=fEhAAAAAYAAJ&hl=nl&pg=PA106.0,Daniel Shanahan|Eva Shanahan,2014,,Copyright 2014 Daniel and Eva Shanahan,,data/No_39_Lame_Dance_Song_(a).krn,kern,,d55d0f8712272780df02fa444d683b0e,https://github.com/shanahdt/densmore/blob/master/Densmore/northern_ute/None.krn,,True,True,,"{""meta.singer_num"": 9.0, ""meta.performer_band"": ""White River and Uinta"", ""meta.performer_age_group"": ""middle"", ""meta.genre"": ""lame dance"", ""meta.bpm_voice"": ""69"", ""meta.bpm_drum"": 69.0, ""file.SOCIAL_FUNCTION"": ""songs of the lame dance"", ""file.REG"": ""Southwest"", ""file.LANG"": ""Non-Tone"", ""file.LING_GROUP"": ""Uto-Aztecan""}",,,"We have before us for consideration two renditions of a song by the same singer (cf. Nos. 77, 78), the first rendition being- recorded in 1914 and the second -in 1916. The duplication was accidental, which adds to the interest of the comparison. On the first occasion the song was sung three times and on the second it was sung twice. Comparing the transcriptions of the two rendi tions, we find in the second a more regular rhythm and also an ornamentation of the melody, as in the third measure. The first-named peculiarity is shown by the presence of rhythmic units, the latter by a larger proportion of whole-tone progressions. Inquiry was made concerning the life of the singer during the two years elapsing between the making of the records, as the rhythm might possibly be influenced by an adaptation to the ways of the white man. The Government officials on the reservation were, however, of the opinion that ho appreciable change had taken place in the singer and the difference in the records was attributed by them to a difference in mood at the time of recording.",,
ute040,densmore-northern-ute,0.0.1,Lame Dance Song (b),,"Whiterocks, Utah",40.4675,-109.929722,False,Ute,utee1244,Ute,Nd58,NT19,dance,Tim Johnson,male,voice|drum,True,True,True,E major,,,76,1.0,2/4|3/4,,Frances Densmore,,1914,1916,densmore1922ute,book,Northern Ute Music,Frances Densmore,1922,109.0,40.0,,720,https://books.google.nl/books?id=fEhAAAAAYAAJ&hl=nl&pg=PA109.0,Daniel Shanahan|Eva Shanahan,2014,,Copyright 2014 Daniel and Eva Shanahan,,data/No_40_Lame_Dance_Song_(b).krn,kern,,949119a1dd2747cbb19ae2f6cdfd2a48,https://github.com/shanahdt/densmore/blob/master/Densmore/northern_ute/None.krn,,True,True,,"{""meta.singer_num"": 16.0, ""meta.performer_band"": ""White River and Uinta"", ""meta.performer_age_group"": ""old"", ""meta.genre"": ""lame dance"", ""meta.bpm_voice"": ""76"", ""meta.bpm_drum"": 76.0, ""file.SOCIAL_FUNCTION"": ""songs of the lame dance"", ""file.REG"": ""Southwest"", ""file.LANG"": ""Non-Tone"", ""file.LING_GROUP"": ""Uto-Aztecan""}",,,"This song contains only one word (Tsiyuta), said to be the Shoshoni term applied by them to the Utes. The rhythmic struc ture of the song comprises four periods, each containing four meas ures, except the third, which has only three measures. Each of these periods ends with a triple measure. In melodic form the song is characterized by wide expansion and small intervals, the range being 1 1 tones and about 60 per cent of the progressions being smaller than a major third. (See No. 2&.) Three renditions were recorded, the only differences being a slight variation in the fourth measure. The song contains all the tones of the octave.",,
ute041,densmore-northern-ute,0.0.1,Lame Dance Song (c),,"Whiterocks, Utah",40.4675,-109.929722,False,Ute,utee1244,Ute,Nd62,NT19,dance,Paul Pegaroos,male,voice|drum,True,True,True,E major,,,63,1.0,3/4|2/4,,Frances Densmore,,1914,1916,densmore1922ute,book,Northern Ute Music,Frances Densmore,1922,110.0,41.0,,768,https://books.google.nl/books?id=fEhAAAAAYAAJ&hl=nl&pg=PA110.0,Daniel Shanahan|Eva Shanahan,2014,,Copyright 2014 Daniel and Eva Shanahan,,data/No_41_Lame_Dance_Song_(c).krn,kern,,445783d125fb40b7ea840a1f31f8de5c,https://github.com/shanahdt/densmore/blob/master/Densmore/northern_ute/None.krn,,True,True,,"{""meta.singer_num"": 17.0, ""meta.performer_band"": ""Uncompahgre"", ""meta.performer_age_group"": ""old"", ""meta.genre"": ""lame dance"", ""meta.bpm_voice"": ""63"", ""meta.bpm_drum"": 63.0, ""file.SOCIAL_FUNCTION"": ""songs of the lame dance"", ""file.REG"": ""Southwest"", ""file.LANG"": ""Non-Tone"", ""file.LING_GROUP"": ""Uto-Aztecan""}",,,"Two renditions of this song were recorded, and in both are found the same number of sixteenth notes in the third measure from the close, this phrase being divided into three groups of two notes each. The song contains no rhythmic unit, though several measures begin with a dotted eighth followed by a sixteenth note. A short connective phrase was sung between the renditions. (See No. 7.) For other songs containing rests see analysis of No. 8. Sixty- five per cent of the progressions are whole tones —a peculiarity noted in the analysis of No. 28.",,
ute042,densmore-northern-ute,0.0.1,Closing Song of the Lame Dance,,"Whiterocks, Utah",40.4675,-109.929722,False,Ute,utee1244,Ute,Nd62,NT19,dance,Paul Pegaroos,male,voice|drum,True,True,True,G sharp minor,,,104|112,1.0,2/4,,Frances Densmore,,1914,1916,densmore1922ute,book,Northern Ute Music,Frances Densmore,1922,111.0,42.0,,769,https://books.google.nl/books?id=fEhAAAAAYAAJ&hl=nl&pg=PA111.0,Daniel Shanahan|Eva Shanahan,2014,,Copyright 2014 Daniel and Eva Shanahan,,data/No_42_Closing_Song_of_the_Lame_Dance.krn,kern,,d5e12bdcf4f2c75c87bd0a9c4c0aa54a,https://github.com/shanahdt/densmore/blob/master/Densmore/northern_ute/None.krn,,True,True,,"{""meta.singer_num"": 17.0, ""meta.performer_band"": ""Uncompahgre"", ""meta.performer_age_group"": ""old"", ""meta.genre"": ""lame dance"", ""meta.bpm_voice"": ""104"", ""meta.bpm_drum"": 112.0, ""file.SOCIAL_FUNCTION"": ""songs of the lame dance"", ""file.REG"": ""Southwest"", ""file.LANG"": ""Non-Tone"", ""file.LING_GROUP"": ""Uto-Aztecan""}",,,"This song resembles No. 17, which was sung at the conclusion of the Bear dance, but a comparison of the trend of the two melodies shows the upper tone to be the more important in No. 17 and the lower tone in the present instance. A fundamental and its minor third are the only tones in this song, while No. 17 contains also the minor seventh, occurring as an unaccented tone. This song comprises four periods, all having the same rhythm. It begins and ends on the same tone. (See No. 37.) ,",,
ute043,densmore-northern-ute,0.0.1,Dragging-Feet Dance (a),,"Whiterocks, Utah",40.4675,-109.929722,False,Ute,utee1244,Ute,Nd58,NT19,dance,Tim Johnson,male,voice|drum,True,True,True,E major,,,108,1.0,3/4|2/4,,Frances Densmore,,1914,1916,densmore1922ute,book,Northern Ute Music,Frances Densmore,1922,112.0,43.0,,721,https://books.google.nl/books?id=fEhAAAAAYAAJ&hl=nl&pg=PA112.0,Daniel Shanahan|Eva Shanahan,2014,,Copyright 2014 Daniel and Eva Shanahan,,data/No_43_Dragging-Feet_Dance_(a).krn,kern,,0e8ccd0711357c5ed2693bf34425107a,https://github.com/shanahdt/densmore/blob/master/Densmore/northern_ute/None.krn,,True,True,,"{""meta.singer_num"": 16.0, ""meta.performer_band"": ""White River and Uinta"", ""meta.performer_age_group"": ""old"", ""meta.genre"": ""dragging-feet dance"", ""meta.bpm_voice"": ""108"", ""meta.bpm_drum"": 108.0, ""file.SOCIAL_FUNCTION"": ""songs of the dragging-feet dance"", ""file.REG"": ""Southwest"", ""file.LANG"": ""Non-Tone"", ""file.LING_GROUP"": ""Uto-Aztecan""}",,,"This melody progresses chiefly by the minor third, which constitutes 71 per cent of the intervals. The rhythmic unit comprises five measures and occurs twice. It interesting to note the resemblance between the opening measures of the song and the rhythmic unit. Nine renditions were recorded without a break in the time. The drumbeat was synchronous with the voice.",,
ute044,densmore-northern-ute,0.0.1,Dragging-Feet Dance (b),,"Whiterocks, Utah",40.4675,-109.929722,False,Ute,utee1244,Ute,Nd58,NT19,dance,John Star (Sa'vawitopatš),male,voice|drum,True,True,True,D flat minor,,,104,1.0,2/4|3/4,,Frances Densmore,,1914,1916,densmore1922ute,book,Northern Ute Music,Frances Densmore,1922,113.0,44.0,,746,https://books.google.nl/books?id=fEhAAAAAYAAJ&hl=nl&pg=PA113.0,Daniel Shanahan|Eva Shanahan,2014,,Copyright 2014 Daniel and Eva Shanahan,,data/No_44_Dragging-Feet_Dance_(b).krn,kern,,bf227c19fcd0ee2135d03b219ad84555,https://github.com/shanahdt/densmore/blob/master/Densmore/northern_ute/None.krn,,True,True,,"{""meta.singer_num"": 18.0, ""meta.performer_band"": ""White River and Uinta"", ""meta.performer_age_group"": ""old"", ""meta.genre"": ""dragging-feet dance"", ""meta.bpm_voice"": ""104"", ""meta.bpm_drum"": 104.0, ""file.SOCIAL_FUNCTION"": ""songs of the dragging-feet dance"", ""file.REG"": ""Southwest"", ""file.LANG"": ""Non-Tone"", ""file.LING_GROUP"": ""Uto-Aztecan""}",,,"Nine renditions of this song were recorded without a break in the time. The melody is rhythmic, in character but con tains no rhythmic unit. Only three sorts of progressions occur— the fourth (constituting 32 per cent), the major second (62 per cent), and one interval of a major third (see No. 28) . All the major seconds were uncertain in intonation. The song is harmonic in structure and contains the octave complete except the second and seventh.",,
